,link,body,reporter,title,date,news
103,https://www.hani.co.kr//arti/politics/politics_general/1076801.html,"국민의힘 당대표 선거 출마를 고심 중인 나경원 전 의원이 지난 16일 서울 시내의 한 식당에서 오세훈 서울시장과 만찬을 위해 입장하며 취재진 질문에 답하고 있다. 연합뉴스 나경원 전 국민의힘 의원이 25일 기자회견을 열어 3·8 전당대회에 관한 입장을 밝힌다. 그의 당 대표 출마 여부에 따라 전당대회 구도는 ‘김기현-안철수-나경원’의 3파전 또는 ‘김기현-안철수’ 양강전으로 짜여질 전망이다. 나 전 의원 쪽은 24일 기자들에게 공지문을 내어, 25일 오전 11시 서울 여의도 국민의힘 중앙당사에서 ‘이번 전당대회에 대한 나경원 전 원내대표의 입장 발표가 있겠다’고 알렸다. 나 전 의원은 이날 저녁 서울 용산구 자택 앞에서 기자들과 만나 “결심은 섰고, 내일 말씀드리겠다”며 말을 아꼈다. 이날 오전 나 전 의원과 측근들의 회의에서는 출마 찬반 의견이 맞선 것으로 알려졌다. 한 측근은 <한겨레>에 “양쪽 모두 가능성이 있고 결론은 본인이 낼 것으로 보인다”고 말했다. 나 전 의원은 설 연휴에도 자신을 정치에 입문시킨 이회창 전 한나라당 총재를 만나는 등 당 대표 출마 관련 의견을 들어왔다. 이날 나 전 의원 쪽에서는 “출마 결심은 섰고, 저쪽(윤핵관)에서 ‘반윤(반윤석열)의 우두머리’ 등의 프레임을 씌우고 있어서 이런 프레임을 어떻게 전환할지 논의하고 있다”는 얘기가 나왔다. 당 대표 출마를 선언한다면, 나 전 의원은 ‘비윤(비윤석열계)’ 프레임을 걷어내고 ‘윤심(윤석열 마음) 구애’ 작전을 이어갈 것으로 보인다. 그가 자신의 저출산고령사회위원회 부위원장직 등 공직 해임이 윤석열 대통령의 ‘본의’가 아닐 것이라고 말한 것에 대해 지난 20일 “윤석열 대통령님께 깊이 사과드린다”고 자세를 낮춘 것도 이러한 노력의 일환이다. 나 전 의원이 출마하면 국민의힘 당권 구도는 ‘김기현-안철수-나경원’ 3파전이 돼, 1차 투표에서 표가 분산돼 상위 2명이 다시 겨루는 결선투표 가능성이 커진다. 현재로선 세 후보 모두 ‘친윤’을 표방하고 있지만, 실제로는 ‘친윤(김기현) 대 비윤(나경원·안철수)’ 구도로 흐를 것으로 보인다. 이 경우 결선투표에서 ‘나-안 연대’ 여부가 주요 변수가 된다. 그러나 이날 당 안팎에서는 대통령실과 당 초선 의원 50명의 집중 폭격을 받은 나 전 의원이 결국 ‘윤석열 정부의 성공을 위해 불출마하겠다’고 선언할 것이라는 관측도 끊이지 않았다. 그가 불출마하면, 친윤계의 지원 사격으로 ‘윤심 주자’로 자리잡은 김기현 의원과 안철수 의원의 양강 구도가 된다. 김 의원은 최근 지지율이 급상승하고 있지만 안 의원과의 1 대 1 대결에선 다소 밀리는 상황이다. 여론조사 기관인 코리아리서치가 <문화방송> 의뢰로 지난 18~19일 국민의힘 지지층 389명을 대상으로 가상 양자대결을 조사한 결과, 안 의원이 43.8%로 김 의원(37.6%)을 6.2%포인트 차로 근소하게 앞서는 것으로 나타났다.(자세한 내용은 중앙선거여론조사심의위원회 누리집 참조) 안 의원과 김 의원은 이날도 서로 견제구를 날리며 경쟁을 이어갔다. 김 의원은 기자간담회에서 안 의원을 겨냥해 “대선 행보를 계속 해온 사람이 대표가 된다면 (자신을 도와준 사람에 대한) 빚을 갚기 위해 노력할 거라는 게 상식적 판단”라고 말했다. 안 의원도 기자들과 만나 “김-장(김기현-장제원)연대를 한다고 하면서 김치 냉장고를 사신다고 하시다가 하루 만에 김장연대는 없다고 바꿨다”고 김 의원을 직격했다. 송채경화 기자 khsong@hani.co.kr 김해정 기자 sea@hani.co.kr 오연서 기자 loveletter@hani.co.kr
",  송채경화 기자      김해정 기자     오연서 기자               , 양강이냐  3파전이냐 나경원 입에 달렸다 ,2023-01-24 18:22:00,한겨레
104,https://www.hani.co.kr//arti/politics/diplomacy/1076799.html,"하야시 요시마사 일본 외무상. 연합뉴스 일본이 조선 노동자들이 강제 동원된 사도광산의 유네스코 세계유산 등재 신청을 한 데 이어, 외무상이 연례 연설에서 독도에 대해 “일본 고유의 영토”라고 주장했다. 한-일 간 산적한 악재가 점차 수면 위로 부상하는 가운데 양국 정부는 일제 강제동원 문제 협상에 속도를 내고 있다. 하야시 요시마사 일본 외무상은 지난 23일 시작된 정기국회 외교연설에서 “시마네현 다케시마(일본이 주장하는 독도의 명칭)는 역사적 사실에 비춰 봐도, 국제법상으로도 일본 고유의 영토”라고 주장했다. 기시다 후미오 현 일본 총리가 외무상이던 2014년 외교연설에서 주장한 뒤 10년째 일본 외무상이 같은 발언을 되풀이한 것이다. 이에 외교부는 같은 날 오후 임수석 대변인 명의 성명을 내어 “일본 정부는 독도에 대한 부당한 주장을 반복하는 것이 미래지향적 한-일 관계 구축에 어떠한 도움도 되지 않는다는 점을 분명히 자각해야 할 것”이라며 발언을 즉각 철회할 것을 촉구했다. 일본은 사도광산의 유네스코 세계유산 등재에도 힘을 싣고 있다. 하야시 외무상은 일제강점기 조선인 강제노역 현장인 니가타현 ‘사도광산’의 유네스코 세계유산 등재에 대해 “확실히 역할을 다할 것”이라고 밝혔다. 일본 정부는 지난 19일(현지시각) 프랑스 파리에 있는 유네스코 세계유산사무국에 사도광산을 내년 세계유산에 등재하기 위한 정식 추천서를 제출했는데, 이를 성사시키겠다고 외무상이 재확인한 것이다. 2월부터는 국내 여론을 자극할 사안들이 줄줄이 예고돼 있다. 당장 올 상반기에만 △일본의 ‘다케시마의 날’(2월22일) 행사 △일본 문부과학성의 교과서 검정 결과 발표(3월) △야스쿠니 신사 봄 제사(4월) △후쿠시마 원전 오염수 방류(상반기 중) 등이 기다리고 있다. 각종 악재에도 한·일 양국은 강제동원 협상에 속도를 내고 있다. 서민정 아시아태평양국장과 후나코시 다케히로 일본 외무성 아시아대양주국장은 지난 16일 도쿄에서 만난 데 이어 이달 말께 서울에서 국장급 협의를 추진 중이다. 통상 한달에 한번 열렸던 국장급 협의 주기가 빨라지는 것은 강제동원 해법을 둘러싼 양국의 막판 조율이 속도를 내고 있다는 것을 의미한다. 정부는 일본 기업 대신 일제강제동원피해자지원재단이 ‘제3자 변제’ 방식으로 배상하는 방안을 피해자들의 반발 속에 추진하고 있다. 대통령실은 이르면 다음달 안에 강제동원 문제를 마무리 짓고 한-일 관계 정상화, 한-일 정상 간 셔틀외교 복원 등에 적극 나서겠다는 방침이다. 대통령실 고위 관계자는 <한겨레>에 “(과거사 문제의 해결은) 빠르면 빠를수록 좋다”며 “물이 들어오고 있고, 노 저을 준비가 되고 있다. 실무 차원에서 현안 조율을 위해 열심히 만나는 중”이라고 말했다. 윤석열 대통령의 방일 시기 또한 이르면 다음달, 늦어도 5월이라는 쪽에 무게가 실린다. 일본 정부는 오는 5월 히로시마에서 열리는 주요 7개국(G7) 정상회의에 윤 대통령을 초청하는 방안을 검토 중인 것으로 알려졌다. 김준형 전 국립외교원장은 <한겨레>와 한 통화에서 “사도광산의 유네스코 유산 지정이나 역사 교과서 문제 등은 예정된 것들이기 때문에, 한국 여론을 고려해 양국이 이런 사안에 대한 비판 수위를 조절하는 동시에 강제동원 협상 시점도 조율해 나갈 것으로 본다”고 말했다. 신형철 기자 newiron@hani.co.kr 김미나 기자 mina@hani.co.kr
",  신형철 기자     김미나 기자                   ,  독도는 일본땅  외치는데도 강제동원 협상 속도 내는 정부 ,2023-01-24 18:20:00,한겨레
105,https://www.hani.co.kr//arti/politics/politics_general/1076794.html,"이재명 더불어민주당 대표가 20일 오전 화재가 발생한 서울 강남구 개포동 구룡마을 화재 현장을 방문해 소방당국의 설명을 듣고 있다. 사진 연합뉴스 이재명 더불어민주당 대표의 ‘대장동 개발 특혜 의혹’과 관련해 검찰 출석을 앞두고 야당 내 ‘동상이몽’이 커져가고 있다. 이 대표를 비롯한 친이재명계가 설 명절을 전후해 수사 대응을 비롯한 방어전략 마련에 부심한 반면, 비이재명계는 최근 외곽에서 잇따라 세 결집에 나서며 ‘유사시’에 대비하는 모양새다. 조정식 민주당 사무총장은 24일 기자간담회에서 “검찰이 제1야당 대표에게 밥 먹듯이 소환 통보를 날리고, 하루 조사면 되는 것을 이틀로 쪼개겠다며 ‘쪼개기 소환’까지 하겠다고 한다”며 이 대표를 겨냥한 검찰의 수사 행태를 비판했다. 이 대표가 ‘28일 출석해 조사를 받겠다’고 밝힌 뒤 ‘사건 내용이 방대해 두차례의 조사가 필요하다’는 검찰 쪽 입장이 흘러나온 데 따른 것이다. 이 대표 쪽에선 성남에프시(FC) 후원금 의혹에 견줘 ‘대장동 의혹’ 대응이 더욱 간단치 않을 것이라고 보고 있다. 1년 넘게 수사를 벌여온 검찰이 최근 전방위적 압수수색과 참고인 조사 등으로 보강에 나서고 있어, 자칫 준비가 미흡할 경우 검찰 수사에 말려들 수도 있다고 봐서다. 이 대표는 이에 28일 소환조사를 앞두고 지난 20일 귀성 인사와 서울 구룡마을 화재 현장 방문을 끝으로 공식 일정을 잡지 않은 채 대응 전략 마련에 집중하고 있는 것으로 전해졌다. 아울러 지난 21일 “민주당이 주저 없이 민생의 길로 나아갈 수 있도록 힘을 모아달라” “하나 된 힘으로 야당 탄압에 맞서겠다”는 메시지를 당원들에게 보낸 데 이어, 25일엔 당내 강성 초선 의원 모임인 ‘처럼회’와 오찬을 하며 검찰 수사 등 현안에 대해서도 논의할 예정이다. 당 안팎에선 검찰의 정치 보복성 수사에 대한 투쟁의 수위를 높여야 한다는 목소리도 나온다. 민주당 지도부 관계자는 “당원들 사이에서 왜 장외투쟁에 나서지 않느냐는 항의가 빗발친다”고 전했다. 다만 이 관계자는 “지금은 민생위기가 워낙 심각해서 (지도부 안에선 민생 챙기기와 대검찰 투쟁) 쌍끌이 전략을 취할 때라는 의견이 강하다”고 말했다. 이 대표를 향한 검찰 수사가 숨가쁘게 이어지면서 당내 비명계의 움직임도 분주해지고 있다. 그간 비명계가 이 대표의 ‘유고사태’가 발생할 경우를 대비하며 관망했다면, 검찰이 이렇다 할 진전 없이 지지부진한 수사를 이어가자 현 사태가 내년 총선까지 장기화할 가능성에 무게를 싣고 세 결집에 나서는 모양새다. 지난 18일 문재인 정부 인사들이 꾸린 정책포럼 ‘사의재’가 출범한 데 이어, 친문재인계 의원 60여명이 참여하는 싱크탱크 ‘민주주의 4.0’도 같은 날 토론회를 열고 ‘선거제도 개혁에 적극 나서겠다’고 밝혔다. 지난해 대선과 지방선거 이후 이상민·이원욱·김종민 등 비명계 의원 30여명이 모여 선거 패배 원인을 진단해온 ‘반성과 혁신’ 토론회 모임도 조직을 확대 개편해 오는 31일 ‘민주당의 길’로 새롭게 문패를 내걸고 당의 미래를 위한 대안을 내놓겠다고 벼르고 있다. 한 비명계 의원은 “앞으로 민심이 어떻게 움직일지 예측하기 어렵지만 당이 이렇게 무기력한 상태로 검찰 수사만 지켜볼 순 없다. 이 대표에 대한 체포동의안이 던져지면 그때 민주당도 시험대에 오르지 않겠나”라고 말했다. 엄지원 기자 umkija@hani.co.kr
",  엄지원 기자                 , 이재명  일정 안 잡고 검찰 출석 대비 당원들에  힘 모아달라  ,2023-01-24 18:16:00,한겨레
106,https://www.hani.co.kr//arti/politics/politics_general/1076775.html,"유승민 국민의힘 전 의원이 지난 9월 오전 대구 북구 경북대학교에서 ‘무능한 정치를 바꾸려면’이라는 주제로 특강을 하고 있다. 연합뉴스 유승민 전 국민의힘 의원이 국민의힘 전당대회(3월8일) 출마 여부를 두고 장고를 이어가고 있다. 유 전 의원은 설 연휴를 앞둔 지난 20일 “올해는 민생 경제의 어려움이 어느 해보다 큰 상황이라 마음이 더 무겁다”며 “먹고 살기가 어려운 모든 분들께 따뜻한 위로를 드리고 새해 우리 정치가 민생을 해결하고 경제를 살리는 역할에 충실하기를 기대한다”는 글을 페이스북에 올렸다. 지난 11일 대구에서 한 언론 간담회에서 “(국민의힘 당대표가) 제 정치적 소명이 맞느냐에 대해 스스로에게 묻고 있고 확신이 들면 결심을 밝히겠다”고 밝힌 것을 끝으로, 열흘 넘게 공식 일정을 잡지 않은 채 페이스북으로만 간간이 메시지를 내놓으며 고민을 이어가고 있는 것이다. 당 안에선 대체로 유 전 대표가 결국 당대표 출마를 포기하지 않겠냐고 보는 분위기다. 당대표 후보 등록(2월2~3일)이 열흘밖에 남지 않았지만, 유 전 의원 쪽에선 선거 캠프를 꾸리는 등 가시적인 움직임이 나타나지 않는 것도 이런 전망을 부추긴다. 특히 ‘유승민계’로 분류됐던 강대식·김병욱·신원식 의원 등은 지난 17일 나경원 전 의원을 규탄하는 초선 의원들의 공동 성명서에 이름을 올려 “대통령을 흔들고 당내 분란을 더 이상 야기해서는 안된다”는 분위기에 동참하고 있다. 신 의원의 경우, 아예 언론을 통해 “(유 전 의원을) 지지하지 않는다”고 밝히기까지 했다. 내년 총선 공천을 앞두고 이들이 ‘유승민 색깔 빼기’에 나선 것이란 해석이 나왔다. 하지만 ‘친윤(친윤석열계) 대 반윤’ 구도가 심화되면서, 유 전 의원의 출마는 여전히 살아있는 카드란 평가도 나온다. 유 전 의원이 일반 국민을 대상으로 한 여론조사에서 ‘국민의힘 당 대표 적합도’ 1위를 기록하는 등 영향력이 여전한 만큼, 후보 간 전략적 제휴 가능성도 있지 않겠냐는 것이다. 한 초선 의원은 24일 <한겨레>에 “나경원·유승민 두 사람이 동시에 출마할 경우 한 사람만 나오는 것보다 시너지 효과를 발휘할 수 있다”며 “흥행몰이를 통해 결선에서 뒤집으려고 하지 않겠느냐”고 말했다. 송채경화 기자 khsong@hani.co.kr
",  송채경화 기자                  , 유승민은 결국 포기하는 것일까 열흘 넘게 공개일정  0  ,2023-01-24 15:54:00,한겨레
107,https://www.hani.co.kr//arti/politics/polibar/1076716.html,"윤석열 대통령이 지난 9일 청와대 영빈관에서 열린 보건복지부·고용노동부·여성가족부·식품의약품안전처·질병관리청 새해 업무보고에 참석해 머리 발언을 하고 있다. 대통령실 제공 “옛날에 선거 때 막 돈 쓴다고 그러면 선거자금은 뭐 한 100억을 뿌렸는데 막상 유권자에게 돌아가는 건 10%만 돌아가도 선거에 이긴다는 옛날 얘기가 있었잖아요…” 윤석열 대통령이 지난 9일 보건복지부?고용노동부?여성가족부 업무보고를 받은 뒤 쏟아낸 마무리 발언 중 일부입니다. 이날 윤 대통령은 약자 복지를 언급하는 과정에서 검증되지 않은 얘기나 국정과제 핵심과는 거리가 먼 사례 등을 들며 5000자에 가까운 발언을 쏟아냈습니다. 대통령실은 이번 부처 업무보고가 시작되기 전 윤석열 정부의 국정과제를 국민에게 직접 보고하는 형식의 ‘대국민 보고’가 될 것이라고 홍보했습니다. 그러나 18개 부처 가운데 15곳이 업무보고를 마쳤지만, 윤 대통령의 발언은 긴 분량에도 요점을 알기 힘든 ‘난수표’에 가까웠습니다. 대통령 업무보고는 취임 뒤 두 번째입니다. 지난해 여름 용산 대통령실에서 윤 대통령과 각 부처 장관의 독대로 진행한 첫 업무보고와는 달리 부처 관계자뿐 아니라 전문가와 정책수요자 등이 참석한 대규모 업무보고였습니다. 대통령실 안팎에선 핵심 정책에 관한 대통령의 생각을 부처 공무원들과 민간이 직접 공유할 수 있는 기회가 될 것이라고 기대했습니다. 대통령실은 “오로지 국민과 국익만 생각하고 나아가겠다는 윤석열 정부의 확고한 철학과 정체성을 보여주는 업무보고가 될 것으로 기대한다”고 했습니다. 그러나 막상 공개된 윤 대통령의 발언은 번번이 입길에 올랐습니다. 짧게는 9분에서 길게는 28분 동안의 마무리 발언에선 현실과 거리가 있는 인식을 드러냈습니다. 윤 대통령은 지난 5일 교육부 업무보고에서 “학교 다닐 때 국어가 재미가 없었다. 우리말을 무엇 하러 또 배우나. 저도 학교 다닐 때 국어가 재미가 없었다. 문학 하시는 분들은 청록파, 이런 것을 국어라고 했지만 그게 아니다” 고 말해 논란이 일었습니다. 또 “어떤 시라든가 이런 거를 놓고 우리가 거기에 대해서 뭔가 자기의 느낌을 적는다든지 이런 것을 통해서 한다면 재미없어 할 사람이 아마 없지 않겠나 싶다” 고 말했으나, 실제 교과서엔 이미 그런 내용이 있어 윤 대통령이 현실도 모른다는 지적이 나왔습니다. 마무리 발언이 길어지다 보니 불필요한 발언도 적지 않았습니다. 윤 대통령은 “일본도 이제 머리 위로 (북한의) 아이아르비엠(IRBM·중거리탄도미사일)이 날아다니니까 방위비를 증액하고 소위 반격 개념을 국방계획에 집어넣기로 하지 않았나. 그걸 누가 뭐라고 하겠나” (지난 11일 외교부·국방부 업무보고)라고 말해 방위비 증액을 뼈대로 한 일본 정부의 국가안보전략을 용인한다는 비판을 받았습니다. 지난 9일 복지부 업무보고에선 연금개혁의 기초작업을 강조하면서 뜬금없이 대법원 표결을 비유로 들기도 했습니다. “어떤 케이스가 대법원에 올라가면 대법원에 법관이 13명이다. 올라가자마자 대법관끼리 표결을 하는 게 아니다. 충분히 연구하고 자료조사하고 회의도 하고, 전원합의로 결론이 안 날 때마다 표결에 들어가는 것이다.” 그래서 연금개혁도 기초 자료수집이 중요하다는 의미에서 예를 든 것이지만, 표결을 위한 자료 수집과 국민여론 수렴을 위한 기초 작업을 같은 선상에서 비교하긴 힘들지 않을까요. 이번 업무보고에서는 정부 정책을 국민에게 소개하는 ‘대국민 보고회’라는 설명이 무색하게 야권을 겨냥하는 ‘정치적 발언’도 적지 않았습니다. “과거 정부가 부동산 문제와 환경 문제를 어떤 정치와 이념의 문제로 인식했다” (3일 국토교통부 업무보고), “생산되는 쌀이 시장에서 어느 정도 소화하느냐와 관계없이 무조건 정부가 매입해주는 이런 식의 양곡관리법은 농민에게도 도움이 되지 않는다” (4일 농림축산식품부 업무보고) 등이 그것입니다. 대통령실은 매번 업무보고가 끝난 뒤 대통령의 전체 발언을 정리해서 공개하고 있습니다. 대통령실은 “(윤 대통령의) 마무리 발언은 사전 원고 없이 즉석에서 대통령의 생각을 전한 것”이라며 “대통령이 갖고 있던 평소 생각, 소신, 철학을 그대로 드러낸 것”이라고 강조합니다. 대통령실 일부 인사들은 “대통령이 아는 게 얼마나 많으면 즉흥 발언을 20분 넘게 하겠느냐” 며 추어올리기도 합니다. 그러나 대통령실 주변에서도 윤 대통령의 ‘폭포수 발언’을 두고 우려가 나옵니다. 국정 철학이나 기조를 상세하게 설명하는 것은 필요합니다. 그러나 정제되지 않은 발언 속에서 부적합한 사례, 부적절한 인용도 늘어가고 있습니다. 그렇다 보니 핵심 메시지는 사라지고 실수만 부각되는 딜레마에 빠지는 것 아니냐는 게 대통령실의 고민이기도 합니다. 국민에게 각인되는 대통령의 메시지는 장편소설보다는 명료한 ‘한 줄의 시’일 것입니다. 배지현 기자 beep@hani.co.kr
",  배지현 기자                 ,  대통령이 얼마나 아는 게 많으면 즉흥 발언을 20분이나   ,2023-01-24 09:13:00,한겨레
108,https://www.hani.co.kr//arti/politics/diplomacy/1076704.html,"지난 13일 서울 종로구 외교부 서희홀에서 열린 신입직원 임용장 수여식에서 박진 외교부 장관과 함께 기념 촬영을 하는 신입 외교관들. 이들도 해외 공관 근무를 하게 되면 설날과 추석에 쉴 수 없다. 연합뉴스 따뜻한 떡국, 가족과 하는 차례, 조카에게 받는 세배. 설날 흔히 볼 수 있는 모습이지만 해외 공관에 나가 있는 외교관에게는 먼 세상 일이다. 해외 공관에서 근무하는 외교관에들에겐 설날과 추석이 ‘휴일’이 아니다. 19일 외교부의 설명을 들어보니, 해외 공관에 근무하는 외교관에게 적용되는 국내 공휴일은 3·1절과 광복절, 개천절, 한글날 등 4대 국경일이 전부다. 추석과 설날은 적용되지 않는다. 추석과 설날은 우리의 명절일 뿐, 공관이 있는 국가에서는 평일 그 이상도 이하도 아닌데, 공관 근무자만 사나흘씩 쉴 수 없다는 게 외교부의 설명이다. 심의관급 ㄱ 외교관은 “설날에 일한 기억밖에 없다. 똑같이 출근해서 죽어라고 일을 했다”고 푸념했다. 오히려 추석과 설날에 일이 더 몰리기도 한다. 인기 관광지의 경우 연휴를 맞아 한국인 관광객이 쏟아져 들어오기도 하고, 재외국민을 챙기는 교민 행사들이 열리기도 해서다. 국장급 ㄴ외교관은 “큰 공관의 경우, (설·추석 연휴에) 혼자 사시는 노인분들이나 환자분들에게 떡국을 갖다 드리는 행사를 하기도 한다”고 말했다. 한국의 외교부 본부에서 일하는 외교관들도 마음 편히 쉴 수 없는 상황에 놓인다. 해외 공관에서 일이 벌어질 경우 외교부 본부에서 이를 뒷받침 해야 하기 때문이다. ㄷ 외교관은 “해외 공관에선 계속 일을 하니, 업무 내용을 확인해야 하는 본부 직원들도 같이 일을 할 수밖에 없다”고 말했다. 그는 “그래도 우린 가족들은 만날 수 있으니, 아무래도 고향 생각이 간절한 공관 직원보다는 사정이 더 낫다”고 말했다. 타국에서 자긍심으로 근무한다지만, 뉴스에서 이어지는 명절 관련 소식은 향수병을 자극한다. 이 때문에 해외 공관을 책임지는 공관장들은 직원들과 함께 명절날 아침 떡국을 함께 먹는 등 조촐한 행사를 열기도 한다. 신형철 기자 newiron@hani.co.kr
",  신형철 기자                  , 가족이 그리운 해외 공관 외교관들  설날요  늘 일한 기억뿐  ,2023-01-23 15:46:00,한겨레
