,link,body,reporter,title,date,news
194,https://www.hani.co.kr//arti/politics/politics_general/1076048.html,"이정미 정의당 대표가 17일 오전 국회에서 열린 2023년 새해 기자회견을 하고 있다. 김경호 선임기자 jijae@hani.co.kr 이정미 정의당 대표가 17일 “노동의 권리와 복지국가의 근간을 흔드는 일을 결코 좌시하지 않겠다”며 화물차 안전운임제와 노란봉투법 도입을 거듭 촉구했다. 이 대표는 이날 국회에서 열린 새해 기자회견에서 “1997년 아이엠에프(IMF) 위기, 2008년 세계금융위기는 물론 지난 3년의 팬데믹 위기에서도 늘 고통 감수를 강요받고 쓰러진 건 노동자와 서민”이라며 △화물차 안전운임제 실시 △노란봉투법(노동조합 및 노동관계조정법 개정안) 제정 △중앙정부의 일자리 재정 확대를 뼈대로 한 노동존중 3대 과제를 제안했다. 새 지도부 구성 이후 재창당 작업에 들어간 정의당이 노동계 지지 기반을 회복하기 위해 노동 과제에 방점을 찍은 것이다. 이 대표는 특히 거대양당에 노란봉투법 입법을 촉구했다. 이 대표는 더불어민주당을 향해 “제1야당다운 책임정치를 보여달라”며 국회 환경노동위원회 즉각 개최를 요구했다. 국민의힘에도 “노란봉투법 논의를 한다면 상임위 자체를 참여하지 않겠다는 식의 태도를 계속 보여왔던 것에 강력한 유감을 표한다”고 말했다. 아울러 이 대표는 노동시간 유연화, 기업에 유리한 파견법 개정을 추진하고 있는 윤석열 정부의 노동개혁을 “그나마 있는 일자리와 여전히 열악한 노동조건을 더 불안하게 만드는 조처”라고 비판했다. 이 대표는 정부에 하청노동자 임금 보호를 위한 근로기준법 개정 등 미래노동시장연구회의 권고안부터 이행하라고 했고 공정거래위원회의 원청 횡포 감시를 강화하라고 촉구했다. 이 대표는 이재명 더불어민주당 대표가 지난 12일 제안한 대통령 결선투표제 원포인트 개헌에 동의하며 힘을 실었고, 선거제도 개혁 방안으로는 연동형 비례대표제를 꼽았다. 이 대표는 “비례성, 대표성, 다양성을 강화하는 국회를 만든 게 핵심”이라며 “그게 가장 잘 반영될 수 있는 선거제가 연동형 비례대표제라고 하는 정의당의 기존 입장은 변함이 없다”고 했다. 윤 대통령이 선거제도 개혁안으로 제시한 중대선거구제에 대해선 “2∼4인(을 선출하는) 중대선거구제만으로는 비례성, 대표성 강화로 가기 어렵다”며 부정적으로 평가했다. 조윤영 기자 jyy@hani.co.kr
",  조윤영 기자                   , 정의당 이정미  노동권 근간 흔드는 일  좌시 않겠다  ,2023-01-17 15:29:00,한겨레
195,https://www.hani.co.kr//arti/politics/politics_general/1076046.html,"아랍에미리트(UAE)를 국빈 방문 중인 윤석열 대통령이 16일(현지시각) 아부다비 릭소스 마리나 호텔에서 열린 한-아랍에미리트 비즈니스 포럼에서 박수를 치고 있다. 연합뉴스 아랍에미리트(UAE)를 국빈 방문 중인 윤석열 대통령이 16일(현지시각) 순방 경제사절단에게 “공무원들을 상대하실 때 ‘갑질이다’ 싶은 사안은 제게 직접 전화해달라”고 말했다. 윤 대통령은 경제외교 성과를 앞세우며 자신이 ‘대한민국 영업사원’이라고 자처했다. 윤 대통령은 이날 저녁 아부다비의 한 호텔에서 경제사절단으로 동행한 국내 기업인 130명과의 만찬에서 “갑질은 대한민국 공무원의 자세가 아니다. 용산(대통령실)에 알려주시면 즉각 조치하겠다”며 이렇게 말했다. 이 자리에는 이재용 삼성전자 회장과 최태원 에스케이(SK)그룹 회장, 정의선 현대차그룹 회장 등 기업인 130명이 참석했다. 윤 대통령은 행사 전 간담회장 입구에서 배우자 김건희 여사와 함께 경제사절단에게 일일이 악수를 하며 친밀감을 드러냈다. 이번 순방에서 48건의 양해각서(MOU)와 계약 체결을 맺은 윤 대통령은 민간주도 성장 중심의 국정 운영을 강조했다. 윤 대통령은 “공무원들은 늘 기업에 대한 서비스 정신으로 무장해야 한다”며 “저도 공직에 있다는 생각보다는 기업 영업부서나 기획부서 직원이라는 생각으로 임하고 있다”며 “저는 대한민국 영업사원”이라고 말했다. 이어 그는 “첫째도 경제, 둘째도 경제, 셋째도 경제라는 각오로 국정을 운영하겠다”며 “우리 정부가 추구하는 경제는 기업 중심, 시장 중심”이라며 “기업 혼자 뚫기 어려운 시장을 함께 뚫어내는 것이 진정 정부가 해야 할 일”이라고 덧붙였다. 윤 대통령은 무함마드 빈 자이드 알 나흐얀 아랍에미리트 대통령의 300억달러(약 37조2000억원) 한국 투자 결정을 언급하며 “무함마드 대통령이 ‘어떤 상황에서도 약속을 지키는 대한민국, 어떤 어려움이 있어도 계약을 이행하는 한국기업’을 언급했다”며 “경제인 여러분께서 일궈낸 성과”라고 말했다. 아울러 윤 대통령은 “이번에 여러분이 창출한 성과들은 새로운 중동 붐을 여는 신호탄이 될 것”이라며 “정부와 기업은 한몸이고 원팀이다. 제가 일자리 창출을 많이 하는 기업인들을 업고 다니겠다고 했는데 대한민국 기업이 세계 시장에서 역량을 펼치고 뛸 수 있도록 업고 다니겠다”고 말했다. 아랍에미리트(UAE)를 국빈 방문 중인 윤석열 대통령과 김건희 여사가 16일 오후(현지시각) 아부다비의 한 호텔에서 열린 동행 경제인과의 만찬 간담회에서 국기에 대한 경례를 하고 있다. 연합뉴스 아부다비/김미나 기자 mina@hani.co.kr 배지현 기자 beep@hani.co.kr
",  김미나 기자     배지현 기자                   , 윤 대통령  정부 기업은 한몸 공무원 갑질땐 제게 전화달라  ,2023-01-17 15:20:00,한겨레
196,https://www.hani.co.kr//arti/politics/politics_general/1076015.html,"이정미 정의당 대표가 17일 오전 국회에서 열린 2023년 신년 기자회견에서 발언하고 있다. 김경호 선임기자 jijae@hani.co.kr 이정미 정의당 대표가 17일 “권력구조 전반에 대한 개혁을 다 이룰 수 없다면 대통령 결선투표제 원포인트 개헌부터 합의하자”고 제안했다. 이 대표는 이날 국회에서 열린 새해 기자회견에서 “현재 윤석열 대통령 체제가, 이제 대한민국 대통령제의 한계점에 이른 것이 아닌가 생각한다”며 “다음 총선에서 반드시 선거제 개혁을 이뤄 다원화된 국회를 만들고, 다원화된 국회 안에서 진지하게 현재 권력구조에 대한 논의할 수 있는 체계를 만드는 것이 필요하다”고 말했다. 이재명 대표가 제안한 대통령 4년 중임제에 대해선 “국민의힘에서도 합의를 이루기 어렵고 굉장히 깊이 있는 논의가 필요하다”며 “국민의힘 당권 선거에 결선투표제가 필요하다고 도입한 만큼 그 취지를 권력구조에 그대로 대입하면 결선투표제에 대해 합의를 못 할 바도 없다”고 말했다. 이정미 정의당 대표가 17일 오전 국회에서 열린 2023년 신년 기자회견에서 발언하고 있다. 김경호 선임기자 이 대표는 선거제도 개혁 방안으로 연동형 비례대표제를 거듭 꼽았다. 이 대표는 “비례성, 대표성, 다양성을 강화하는 국회를 만든 게 핵심”이라며 “그게 가장 잘 반영될 수 있는 선거제가 연동형 비례대표제라고 하는 정의당의 기존 입장은 변함이 없다”고 밝혔다. 다만 윤석열 대통령이 언론 인터뷰에서 언급한 중대선거구제 도입에 대해선 “윤 대통령이 제안한 2∼4인까지 중대선거구제라고 하는 것만으로는 비례성과 대표성 강화로 가기 어렵기 때문에 보다 폭넓은 중대선거구제 내용을 담은 안을 내놔야 한다”고 말했다. 이 대표는 또 “윤석열 정부가 노동의 권리와 복지국가의 근간을 흔드는 일을 결코 좌시하지 않겠다”며 △화물차 안전운임제 실시 △파업 노동자에 대한 기업의 과도한 손해배상 청구를 제한하는 ‘노란봉투법’(노동조합 및 노동관계조정법 개정안) 제정 △중앙정부의 일자리 재정 확대 등을 담은 노동존중 3대 과제를 제시했다. 이 대표는 이태원 참사 책임을 물어 이상민 행정안전부 장관의 탄핵을 요구하겠다고 말했다. 이 대표는 “경찰의 이태원 참사 특별수사본부 수사 결과가 너무 터무니없는 결과로 끝나 이 부분에 대한 특검 추진이 필요하다”며 “이 장관에 대한 파면과 탄핵까지 포함해 끝까지 책임을 묻는 정당이 되겠다”고 말했다. 조윤영 기자 jyy@hani.co.kr
",  조윤영 기자                  , 이정미 정의당 대표   대통령 결선투표  원포인트 개헌부터  ,2023-01-17 12:05:00,한겨레
197,https://www.hani.co.kr//arti/politics/diplomacy/1076009.html,"안나푸르나 베이스캠프 가는 길. 구본권 기자 starry9@hani.co.kr 외교부가 네팔 히말라야 안나푸르나에서 등반하다 숨진 50대 한국인 여성 김아무개씨의 신원을 확인했다고 밝혔다. 외교부 당국자는 17일 “주네팔대사관은 1월16일 안나푸르나 라운딩 트래킹 토롱라 지역에서 한국인으로 추정되는 여성이 노상에서 사망한 채로 발견됐다고 통보받고 네팔 경찰 당국과 접촉해 우리 국민 여부와 사고 경위 등을 확인했다”고 밝혔다. 앞서 네팔 교민사회는 지난 15일 오후 1시께(현지시각) 안나푸르나 트래킹 코스 중 하나인 토롱라 패스에서 50대 한국 여성으로 추정되는 시신이 현지 가이드에 의해 발견됐다고 밝혔다. 이 등산로는 세계에서 가장 높은 고개로 불리는 곳으로 해발 5천m가 넘는 곳에 있다. 현지 경찰은 김씨가 소지한 서류 등을 통해 신원을 확인한 것으로 알려졌다. 김씨는 지난해 12월1일 네팔에 입국했고 1월25일 귀국할 예정이었던 것으로 알려졌다. 외교부 당국자는 “주네팔대사관은 우리 국민의 신원을 파악한 후 국내 유가족과 연락했으며 필요한 영사 조력을 제공 중”이라고 밝혔다. 신형철 기자 newiron@hani.co.kr
",  신형철 기자                   , 안나푸르나 한국인 등산객 1명 사망   50대 여성 신원 확인  ,2023-01-17 11:50:00,한겨레
198,https://www.hani.co.kr//arti/politics/politics_general/1076007.html,"이번 주 ‘공덕포차 화요우당탕’은 변호사비 대납 의혹 등 이재명 더불어민주당 대표 쪽과의 유착 의혹으로 여러 수사를 받는 김성태 전 쌍방울그룹 회장과 양선길 쌍방울그룹 회장의 국내 압송이 이 대표와 민주당에 미칠 영향을 분석해드립니다. 베일에 싸였던 김 전 회장과 양 회장이 마침내 언론에 모습을 드러냈습니다. 검찰 수사를 피해 국외로 도피한 지 8개월 만에 태국에서 버젓이 골프를 치다 체포된 이들은 17일 오전 인천국제공항으로 한국에 도착했습니다. 김 전 회장은 이 대표의 변호사비 대납 의혹은 사실무근이라고 부인했고, 이 대표와도 전혀 모르는 사이라고 했습니다. 관련 의혹을 수사 중인 수원지검은 어떤 수사 결과를 내놓을까요. 이 대표는 다른 사건으로 또다시 검찰로부터 출석 통보서를 받았습니다. 위례·대장동 개발 비리 의혹을 수사 중인 서울중앙지검 반부패수사1부(부장 엄희준)·3부(부장 강백신)가 오는 27일 조사를 받으러 청사로 나와달라고 요청을 한 겁니다. 성남FC 후원금 의혹으로 지난 10일 수원지검 성남지청에서 조사를 받은 지 엿새 만에 소환입니다. 이 대표는 대선 당시 방송에 나와 고 김문기 전 성남도시개발공사 개발사업1처장을 모른다고 말해 공직선거법 위반 혐의로 기소돼 재판을 받고 있기도 합니다. 그런데 최근 유동규 전 성남도시개발공사 사장 직무대리가 과거 호주·뉴질랜드 출장 때 이 대표와 김 전 처장이 같은 조에서 골프 라운딩을 했다는 증언을 검찰 조사에서 내놨습니다. 이 사건으로 벌금 100만원 이상의 형이 확정되면 이 대표는 국회의원직을 잃고 5년간 피선거권도 제한됩니다. 이 대표는 이 모든 수사와 재판 리스크를 극복할 수 있을까요. 이 대표만 보고 내년 총선을 향해 달려가고 있는 민주당은 정말, 정말 괜찮은 걸까요. 오늘도 김완 〈한겨레〉기자 진행으로 김민하, 김수민 시사평론가가 화요일 점심 맛있는 시사·정치 수다로 여러분의 눈과 귀를 즐겁게 해드립니다. 한겨레TV ‘공덕포차 화요우당탕’ 라이브방송 보러 가기 https://youtu.be/egKK8y5pbuY 제작진 기획 : 송호진 프로듀서 : 이경주 김도성 작가 : 박연신 취재 데스크 : 김정필 출연 : 김완 김민하 김수민 행정: 김양임 타이틀 : 문석진 기술: 박성영 음향 : 장지남 카메라 : 권영진 장승호 박경원 자막그래픽디자인·섬네일: 김수경 연출 : 정주용 이규호 임여경 ( graceyyk0826@hani.co.kr ) 제작: 한겨레TV
",  임여경 기자     김정필 기자                   ,  공덕포차 화요우당탕 쌍방울  넘버 1  2  체포  이재명과 민주당의 운명은  ,2023-01-17 11:46:00,한겨레
199,https://www.hani.co.kr//arti/politics/assembly/1075992.html,"더불어민주당 최고위원회의에서 이재명 대표가 고민정 최고위원과 대화를 나누고 있다. 공동취재사진 ‘대장동 개발 특혜 의혹’을 수사중인 검찰이 이재명 더불어민주당 대표에게 출석을 요구한 것을 두고 더불어민주당 최고위원인 고민정 의원이 “조준해서 명중시키지 못하고 무차별적으로 난사하고 있다”고 비판했다. 고 의원은 17일 <문화방송>(MBC) 라디오 인터뷰에서 “야당에 대한 존중은 저희가 바라지도 않는다. 그러나 최소한 상식적인 수준에서 수사에 임해야 하는 게 아니냐”며 이렇게 말했다. ‘성남에프시(FC) 후원금 의혹’과 관련 이 대표를 불러 조사한 지 일주일 만에 이 대표 쪽과 제대로된 일정 조율도 없이 대장동 개발 특혜 의혹과 관련 검찰 출석 요구를 한 사실을 공개하는 등 속도전하듯 이뤄지고 있는 검찰의 수사 행태를 꼬집은 것이다. 그는 “야당 대표에 대해서는 이런 식으로 무차별적인 난사 수준으로 (수사) 하면서 정작 살아있는 권력에 대해서는 털끝 하나 건드리지 못하고 있는 게 검찰의 모습”이라며 김건희 여사와 관련한 검찰의 도이치모터스 주가조작 의혹 사건 수사를 이 대표 수사에 견줘 비판했다. 고 의원은 한동훈 법무부 장관에 대해서도 작심 비판했다. 그는 “법무부 장관이라면 개별 사건에 대해서는 일절 언급하지 않는 게 상식적”이라며 “그 분은 장관을 그만두셔야 하는 발언들을 너무 많이 하고 있다”고 말했다. 전날 한 장관이 국회에서 기자들과 만나 이 대표 수사와 관련해 “성남(성남에프시 후원금 의혹)이든 대장동(대장동 개발 특혜 의혹)이든 성남시에서 있던 지역 토착비리 범죄 혐의로, 통상적인 범죄 수사 절차에 따라 공정히 수사할 것”이라고 말한 데 따른 비판이다. 고 의원은 한 장관에 대해 “장관을 할 생각이 없는 것인지 아니면 법 위에 자신이 있다는 자신감 때문인 건지 모르겠으나 장관으로서의 태도를 이미 다 잃고 있는 것 같다”고 지적했다. 비이재명계 일각에서 ‘이 대표 수사와 당은 분리 대응해야 한다’는 주장이 나오는 데 대해선 “이 대표는 일부러라도 수사 얘기를 하지 않고 있는데, ‘분리 대응해야 된다’는 발언들이 오히려 당을 계속 그쪽으로 몰아가고 있는 역효과를 불러내고 있다”고 맞받았다. 엄지원 기자 umkija@hani.co.kr
",  엄지원 기자                   , 고민정  이재명 검찰수사 무차별 난사 산 권력은 털끝도 못 건드려  ,2023-01-17 10:53:00,한겨레
200,https://n.news.naver.com/article/023/0003742153?sid=100,"김종민 더불어민주당 의원. /뉴스1더불어민주당은 설 연휴 기간 이른바 ‘천원(1000원) 당원’ 논란으로 들끓었다. 당 청원 게시판에 “천원 당원을 비하한 의원들을 징계해달라”는 글이 올라오면서다. 글 작성자는 ‘천원 당원’을 비하한 이들로 3선의 이원욱, 재선의 김종민·조응천 의원을 지목했다. 세 의원 모두 비명(비 이재명)계로 분류되는 이들이다.지목된 이들 가운데 한 명인 김종민 의원은 24일 강하게 반발했다. 그는 페이스북을 통해 “제 토론회 발언을 거의 가짜뉴스 수준으로 짜깁기 왜곡해서 전파하고 있다”고 했다. 그는 지난해 11월 토론회에서 “천원 당원 중심으로 가게 되면 동원(되는) 당원 문제를 해결할 수 없다”고 말했다.김 의원은 “(천원 당원 발언은) 당원을 비하한 게 아니다”라며 “오히려 자발적으로 1000원 당비를 내는 당원들의 소중한 참여가 동원당원으로 오해받지 않고, 진짜 권리당원 대접을 제대로 받을 수 있도록 하자는 주장”이라고 했다.그러면서 “많은 당원들이 가짜뉴스에 신경쓰지 않으시길 바란다”며 “언론에서도 사실을 왜곡, 짜깁기한 주장을 여과없이 보도하지 말아주시기를 바란다”고 했다.김 의원은 “(토론회 당시) 제 주장의 취지는 당원들의 참여 기회를 늘리고 권리를 확대하자, 정치인에게 동원되는 구조를 바꿔야 한다는 주장이었다”며 “선거 때마다 당비 대납, 6개월 당원 등 일부 정치인들에 의해 동원되는 사례가 없어지질 않고 있다(는 것)”이라고 했다.김 의원은 “이재명 대표에 대해 바른 소리 좀 했다고 정치적으로 공격하고 몰아내려고 하는 건 그만해야 한다”며 “다른 의견 얘기한다고 왜곡, 짜깁기, 가짜뉴스로 공격하는 건 원래 민주당에서 나온 게 아니다. 과거 자기하고 생각이 다른 사람을 빨갱이나 반동으로 몰아붙이던 독재자들이 하던 행동으로 그걸 이어받아서 국정원 댓글공작단, 일베가 하던 것”이라고 했다.그는 “민주당 내에서 이런 일이 벌어져서는 안 된다. 이 대표를 지지하는 분들도 한번 돌아봐야 한다”며 “이 대표가 당 게시판에서 악마화되어 공격받던 때가 얼마 전으로 그때하고 똑같은 일이 지금 당 게시판에서 벌어지고 있다”고 했다.",오경묵 기자,민주 ‘천원 당원’ 논란에…김종민 “李에 바른 소리 했다고 정치적 공격”,2023-01-24 22:43:00,조선일보
201,https://n.news.naver.com/article/023/0003742121?sid=100,"성일종 국민의힘 정책위의장이 24일 오후 서울 여의도 국회에서 열린 기자간담회에서 발언하고 있다. /뉴시스국민의힘은 24일 더불어민주당이 설 민심을 전하며 추가경정예산(추경) 필요성을 언급한 데 대해 “(민주당) 이재명 대표의 사법리스크를 덮기 위한 정략적 발상”이라고 비판했다.성일종 정책위의장은 이날 오후 기자간담회를 열고 “추경은 국가재정법상 재난이나 전쟁, 대량 실업, 경기침체 같은 때만 하게 돼 있다”며 이같이 밝혔다. 앞서 민주당은 오전 설 민심 기자간담회에서 이재명 대표가 언급한 30조원 규모 ‘긴급 민생 프로젝트’ 제안과 관련해 “필요하다면 입법, 추경 요구 등을 통해 노력하겠다”고 했었다.성 의장은 “정부는 예산안 639조원을 상반기 중 빨리 집행해서 경기를 활성화하려고 모든 노력을 집중하고 있다”며 “(지금) 민주당이 (추경을) 주장하는 것은 상당히 옳지 않다”고 했다.성 의장은 민주당이 난방비 급등 문제를 두고 ‘예비비 편성 지원’을 촉구한 데 대해서도 “문재인 정부에서 2~3배 이상 가스 가격이 올라갈 때 13%밖에 인상을 안 했다. 그 모든 부담은 윤석열 정부의 몫으로 돌아왔다”고 했다.이어 “(LNG 등 원자재의) 시장 가격이 변할 때마다 그 인상분을 (가스 요금에) 반영해주는 게 원칙 아니냐”며 “그런 것들이 (전임 정부에서) 반영이 안 되고 (가격 인상 압박이) 누적돼 왔기 때문에 윤석열 정부가 힘든 것”이라고 했다.성 의장은 설 명절 민심과 관련, 간첩단 사건에 대한 우려와 여러 범죄 혐의를 받는 이재명 대표에 대한 성토가 있었다고 전했다.그는 “(전임 정부에서) 간첩에 대한 첩보가 보고됐음에도 수사를 방해한 것은 있을 수 없는 국가파괴행위라는 큰 우려와 걱정이 있었다”며 “이 대표가 정적제거·야당파괴·정치검찰·정치공작이라는 네 가지 프레임을 잡아 범죄혐의를 벗어나려고 하는 것은 바람직하지 않다는 설 민심이 있었다”고도 했다.",김동하 기자,"與 “野 추경 주장, 이재명 사법리스크 덮으려는 정략적 발상”",2023-01-24 15:50:00,조선일보
202,https://n.news.naver.com/article/023/0003742119?sid=100,"국민의힘 당권주자인 안철수 의원이 24일 서울 여의도 한 식당에서 열린 설 맞이 북한이탈주민 초청 간담회 및 떡국 오찬에서 발언하고 있다. /뉴시스국민의힘 3·8 전당 대회에 나선 안철수 의원은 24일 서울 여의도의 한 식당에서 북한 이탈 주민 초청 오찬 간담회를 가졌다. 안 의원은 “명절인데도 고향에 가서 친척들을 뵐 수 없는 분들이 사실 대표적으로 탈북민분들”이라며 “조그만 위로나 따뜻함을 전달해 주고 싶은 마음에 이렇게 자리를 준비해 봤다”고 말했다.안 의원은 “탈북민에 대한 그런 관심들이라든지 또는 북한 인권에 대한 그런 언급조차도 회피했었던 지난 5년이었다”며 “그런 잘못된 것들을 이제 바로 잡아야 할 때”라고 했다.이날 간담회에는 탈북민 출신으로, 국민의힘 3·8 전당대회에서 청년 최고위원에 출마한 지성호 의원을 비롯해 탈북민 약 30명이 참석해 굴 떡국 오찬을 함께 했다.안 의원은 오찬 간담회 후 기자들에게 당권 경쟁자인 김기현 의원이 ‘1차 투표에서 과반을 확보해 결선 투표에 가지 않을 것’이라고 자신하는 데 대해 “제가 1등을 할 거라는 말씀이시니까 참 감사하게 받아들이겠다”고 했다.그는 “제 목표는 이제는 1차(투표)에서도 1등하는 후보”라며 “수도권 민심도 잘 알고 수도권에서 선거를 치러보고 승리의 경험이 있는 사람이 필요하지 않으냐”라고 했다.안 의원은 김기현 의원이 ‘이재명 더불어민주당 대표의 상대는 같은 흙수저 출신이 돼야 한다’고 말한 데 대해서는 “(김 의원이) ‘연포탕’(연대·포용·탕평)을 외치다 갑자기 ‘진흙탕’을 외치니 당황스럽다”며 “예전에도 ‘김장(김기현·장제원) 연대’를 한다고 하고 오랫동안 유지하기 위해 김치냉장고를 사신다고 하다가 하루 만에 ‘이제 김장연대 없다’고 바꿨다”고 했다.안 의원은 이번 설 연휴에 산업자원부 장관을 지낸 정덕구 니어재단 이사장과 천영우 전 청와대 외교안보수석 등 각계 원로를 만났다고 밝혔다.",김동하 기자,"안철수, 김기현 겨냥 “연포탕 외치다 진흙탕 외치니 당황스럽다”",2023-01-24 15:38:00,조선일보
