,link,body,reporter,title,date,news
298,https://n.news.naver.com/article/023/0003741318?sid=100,"다보스 온 글로벌 CEO들과 오찬다보스포럼 참석차 스위스를 방문 중인 윤석열 대통령이 18일(현지시간) 다보스 시내 한 호텔에서 열린 '글로벌 CEO와의 오찬'에서 발언하고 있다./연합뉴스윤석열 대통령이 18일(현지 시각) 스위스 다보스에서 세계경제포럼(WEF·다보스포럼)에 참석한 국내외 주요 기업인들을 초청해 오찬을 함께했다. 대통령실은 “이번 오찬은 공급망 안정, 디지털 전환, 기후변화 대응 등 다양한 글로벌 문제에 대한 해결책과 민간과 정부의 바람직한 관계 등에 대해 논의하기 위해 마련됐다”고 밝혔다.윤 대통령은 이날 다보스의 한 호텔에서 개최된 ‘글로벌 최고경영자(CEO)와의 오찬’에서 “(한국) 제도가 글로벌 스탠더드에 안 맞으면 언제든 알려 달라”고 했다. 그러면서 “해외 투자가 많이 들어오면 제도를 글로벌 기준에 맞춰갈 수 있다”며 “시장 중심으로 해나갈 것”이라고 했다.이날 오찬에는 우리 측에선 이재용 삼성전자 회장, 최태원 SK그룹 회장, 정의선 현대자동차그룹 회장, 구광모 LG그룹 회장, 신동빈 롯데그룹 회장, 김동관 한화솔루션 부회장을 비롯해 관계 부처 장관들이 참석했다. 해외에선 패트릭 갤싱어 인텔 CEO, 아르빈드 크리슈나 IBM CEO, 크리스티아노 아몬 퀄컴 CEO, 제이미 다이먼 JP모건 CEO, 칼둔 알 무바라크 무바달라 CEO 등 반도체, 전자, 통신장비, 금융을 대표하는 글로벌 기업 대표들이 자리했다. 이외에도 블랙스톤, 뱅크 오브 아메리카(BoA), 비스타 에쿼티 파트너스, 히타치, 셸, 에어리퀴드, 토탈, 네슬레, 티피지, 리포 등 기업 CEO들이 참석했다.다보스포럼 참석차 스위스를 방문 중인 윤석열 대통령이 18일(현지시간) 다보스 시내 한 호텔에서 '글로벌 CEO와의 오찬' 간담회를 하고 있다./뉴시스윤 대통령은 “IBM이 우리나라 초기 컴퓨터 산업과 디지털 산업에 많은 도움을 줬다. 한국IBM이 오래됐다”고 하자, 크리슈나 IBM 회장은 “아마 1950년대에도 있었을 것”이라며 “(현재) IBM과 삼성이 많은 협력을 하고 있다”고 했다. 제임스 쿨터 티피지 공동대표가 “한국 기업들과 파트너십에 관심이 많다”고 하자, 윤 대통령은 “시장을 열고 만들어 놓을 테니까 많이 들어와 달라”며 “우리나라는 기후 변화와 관련해 국가 정책으로 산업화해서 풀어가려고 한다. 규제보다는 탄소중립으로 효율적으로 갈 수 있도록 지원할 것”이라고 했다. 정의선 회장은 “대통령께서 이렇게 잘해주셔서 전체 우리 경제에도 많은 도움이 될 것 같다”고 했다.윤 대통령은 한국의 첨단산업 경쟁력, 우수 인력, 세계적 수준의 자유무역협정(FTA) 네트워크 등을 소개했다. 윤 대통령은 그러면서 “한국을 세계 최고 수준의 혁신 허브로 만들겠다”고 했다. 한국의 투자 환경과 기술 경쟁력을 강조하며 적극적으로 투자 유치에 나선 것으로 해석된다. 대통령실 관계자는 “대통령이 이번 순방에서 자신을 ‘대한민국 영업사원’이라고 밝힌 것처럼 다보스 포럼을 계기로 전 세계 기업인들에게 한국 투자 확대 등 ‘세일즈 외교’를 활발히 펼치고 있다”고 했다.글로벌 CEO들과 오찬 - 스위스를 방문 중인 윤석열 대통령이 18일(현지 시각) 다보스의 한 호텔에서 열린 ‘글로벌 최고경영자(CEO)와의 오찬’에서 참석자들과 대화하고 있다. 왼쪽부터 아르빈드 크리슈나 IBM CEO, 윤 대통령, 패트릭 겔싱어 인텔 CEO, 마크 슈나이더 네슬레 CEO. /연합뉴스윤 대통령은 이날 “최근의 복합 위기 해결을 위해 그 어느 때보다 국가와 기업 간 연대와 협력이 절실하다”며 “기업은 창의와 혁신, 도전정신에 기반해 지속적 성장을 추진하면서 기술혁신을 통해 글로벌 문제를 해결할 수 있을 것”이라고 했다. 윤 대통령은 2030 부산 세계박람회에 대한 관심과 지지도 당부했다고 대통령실은 밝혔다.윤 대통령은 전날 아랍에미리트(UAE) 일정을 마치고 스위스에 도착해 다보스포럼을 중심으로 한 3박 4일간의 스위스 순방 일정에 들어갔다. 다보스포럼은 전 세계 정치·경제 리더들이 모여 국제 현안을 논의하는 민간 주도의 국제회의로, 우리나라 정상의 참여는 2014년 박근혜 전 대통령 이후 9년 만이다.윤 대통령과 김건희 여사는 17일 스위스 방문 첫 일정으로 취리히의 한 호텔에서 열린 동포간담회에 참석했다. 윤 대통령은 “과학기술 경쟁 시대를 맞이해 스위스와 같이 우리와 보편적 가치를 공유하는 기술 선도국들과 첨단 과학기술 협력을 강력히 모색해 나갈 것”이라고 했다. 또 “우리 기업이 전 세계로 뻗어나가게 하는 데 한국의 문화 콘텐츠가 정말 큰 힘이 되고 있다”며 “수십 국 정상이 모이는 다자회의에서 우리 문화 콘텐츠에 대한 관심과 열정을 마주하고 있다”고 했다.",취리히·다보,IBM·인텔 CEO 만난 尹 “한국을 세계최고 혁신허브로 만들 것”,2023-01-18 23:54:00,조선일보
299,https://n.news.naver.com/article/023/0003741315?sid=100,"이재명 더불어민주당 대표가 18일 오후 서울 마포구 망원시장에서 검찰 소환과 관련 입장을 밝히고 있다. /이덕훈 기자이재명 더불어민주당 대표는 18일 김성태 전 쌍방울 회장에 대해 “김성태 회장이라는 분을 만난 일이 없다. 실제로 본 적도 없다”고 했다. 그러면서도 “누군가가 술먹다가 (전화를) 바꿔줬단 얘기가 있는데, 저는 기억이 안 난다”고 했다.이 대표는 이날 KBS 9시 뉴스에 출연해 이같이 말했다. 이 대표는 그동안 김 전 회장을 만난 적 없다고 했고, 김 전 회장도 이 대표를 모른다고 해왔다.김 전 회장은 이 대표의 과거 선거법 위반 재판을 위한 변호사 비용 20여억원을 대신 내줬다는 의혹을 받고 있다. 이 대표는 김 전 회장의 변호사비 대납 의혹에 대해 “대체 누가, 누구에게, 언제, 어디서, 어떤 방법으로, 얼마를 줬는지가 한 개도 밝혀진 게 없다. 일종의 마녀사냥 같은 것”이라며 전면 부인했다. “(검찰이) 변호사비 대납으로 기소하면 미쳤다고 생각한다”고도 했다.이 대표는 김 전 회장과의 친분을 묻는 질문에 “저는 만난 일은 확실히 없다. 이번 사건 수사로 송환한다고 해서 언론에서 얼굴을 본 게 처음”이라고 했다. 전화 통화도 한 적 없느냐는 질문에는 “누군가 술 드시다가 저한테 전화를 바꿔줬다는 얘기가 있는데 저는 기억이 안 난다”고 했다. 그러면서 “사실 술 먹고 전화하는 사람들이 많다. 나 이 사람 안다고 과시하기 위해 전화를 해서 바꿔주는 황당한 일이 많다”며 “그런 경우일 수는 혹시 모르겠는데, 저는 만난 일은 확실히 없다”고 했다.망원시장 찾은 李대표 - 이재명(왼쪽) 더불어민주당 대표가 18일 서울 마포구 망원시장에서 상인들과 만나 인사하고 있다. 이 대표는 이날 망원시장을 둘러본 뒤 기자들과 만나 “아무 잘못도 없는 제게 또 오라고 한다”며 검찰 출석에 응하겠다는 입장을 밝혔다. /이덕훈 기자이 대표는 지난 13일 서울 여의도 민주당사에서 열린 당원 간담회에서 “도대체 저는 김성태라는 분 얼굴도 본 적이 없다”고 한 바 있다. 나흘 뒤 입국한 김 전 회장도 태국에서 압송되기 직전 언론 인터뷰에서 “이 대표와 만나거나 전화한 적 없다”고 했다. 서로 모르는 사이라고 한 것이다.이 대표는 당 대표직을 유지하며 검찰 수사에 대응하겠다는 입장을 밝혔다. 그는 “재판 송사야 저 개인이 감당해야할 몫”이라며 “제가 경기지사를 할 때도 무려 4건이나 기소가 됐음에도 전국 최고 시도지사 평가를 얻어내지 않았나. 저의 선의나 역량이 인정받을 거라 본다”고 했다. 그러면서 “공격하면 힘들어서 피하는 건 저희 당원이나 국민들의 민주당에 대한 기대를 저버리는 것이라 생각한다”고 했다. 자신의 사법리스크가 내년 총선에 영향을 줄 수 있다는 우려에 대해 “그건 집권 여당과 정부에서 원하는 바”라며 “그건 저희가 이겨내야할 몫이고, 상대가 원하는 바대로 의도하는 바대로 끌려갈 수는 없다”고 했다. 김 전 회장과의 친분을 묻는 질문에선 “참나”라는 반응을 보였다.이런 가운데 이 대표는 대장동·위례신도시 개발 특혜 의혹 사건과 관련해 오는 28일 오전 10시 30분 검찰에 출석하겠다고 했다. 이 대표는 이날 서울 마포구 망원시장에서 기자들과 만나 “사적 이익을 위해 검찰 권한을 남용하는 일부 정치 검찰을 역사가 평가할 것”이라며 “그럼에도 불구하고 아무 잘못도 없는 제게 또 오라고 하니 제가 가겠다”고 했다. 앞서 서울중앙지검은 이 대표에게 오는 27일 출석을 요구했다. 하지만 이 대표는 “주중에는 일해야겠으니 27일이 아닌 28일 토요일에 출석하겠다”고 했다. 당 공식 업무가 없는 주말에 출석하겠다는 것이다.이 대표는 이번 출석 때는 의원들과 동행하지 않겠다고 했다. 지난 10일 성남FC 불법 후원금 사건 피의자로 검찰에 출석할 때 민주당 의원 40여 명이 동행해 방탄 논란이 일었는데, 이를 의식한 것으로 보인다. 이 대표는 “우리 당 의원들은 애정도 많으시고 관심도 많으시지만 그 시간에 당무와 국정에 충실하시기 바란다”며 “제가 변호사 한 분 대동하고 가서 당당하게 맞서도록 하겠다”고 했다. 하지만 이 대표 측근 의원 일부는 동행하겠다는 의사를 밝히고 있다.",주희연 기자,이재명 “누군가 술먹다 김성태 전화 바꿔줬다는데... 기억 안난다”,2023-01-18 22:54:00,조선일보
300,https://www.khan.co.kr/politics/politics-general/article/202301241550001,"지난 9일 소집된 1월 임시국회가 보름 넘게 개점 휴업 중이다. 여야는 국회 공전의 책임을 상대에 떠넘기는 데 급급하다. 더불어민주당은 민생 법안 처리 등을 이유로 임시회를 단독 소집했지만 국민의힘이 협조하지 않는다고 주장했다. 국민의힘은 이재명 민주당 대표의 ‘방탄’을 위한 임시국회라고 반발했다.24일 국회에 따르면 지난해 12월31일로 일몰돼 재논의가 필요한 법안들은 여전히 국회에서 잠자고 있다. 화물노동자 안전운임제 법안은 지난달 9일 국토교통위원회를 통과했지만 법제사법위원회에 계류 중이다. 30인 미만 사업장의 8시간 추가연장근로제는 환경노동위원회(환노위)에서 다뤄야 하지만 환노위 전체회의는 이달 중 한 차례도 열리지 않았다. 건강보험 국고지원 법안을 다룰 보건복지위원회도 소집되지 않았다.파업 노동자에 대한 기업의 무분별한 손해배상·가압류 청구를 제한하는 ‘노란봉투법’(노동조합법 개정안)도 환노위 문턱에 가로막혀 있다. 노란봉투법은 국민의힘이 반대하는 데다 원청에 대한 하청노동자의 교섭권을 보장할지를 두고 민주당과 정의당 사이 이견이 있다. 여성가족부 폐지 등 정부조직법 개편 논의도 여야 이견 차가 좁혀지지 않아 난항이다.1월 임시국회가 끝날 때까지 여야 대치는 격화할 것으로 보인다. 민주당은 당장 난방비 급등을 문제 삼았다. 김성환 정책위의장은 이날 국회 기자간담회에서 “작년에 에너지 바우처 대상에게 지급된 총액이 1600억원 남짓이지만 1인당 19만원 정도다. 취약계층에게 한 달치 난방비도 안 되는 금액으로 전기료·난방비 급등을 이겨내라고 할 수 있을지 걱정”이라며 “정부가 긴급하게 재난 예비비라도 편성해서 취약계층에 적극적으로 (지원)해야 한다”고 말했다.성일종 국민의힘 정책위의장은 이날 기자간담회에서 부정적인 입장을 밝혔다. 성 의장은 “정부가 재정적 여력이 있으면 더 지원해야 하는데 (국민들이) 어려움을 겪게 돼 송구스럽다”면서도 “이 부분은 전 세계적 현상이다. 유럽은 5배 이상 난방비가 폭등했다”고 말했다. 그는 “문재인 정부에서 2~3배 가스 가격이 오를 때 13%만 인상해 모든 부담이 윤석열 정부에 돌아왔다”고 했다.성 의장은 민주당의 추가경정예산안(추경) 편성 요구에 대해선 “(예산안) 실행도 이제 시작인데 추경을 이야기하는 것은 이재명 대표의 사법리스크를 덮기 위한 정략적 발상이라 생각한다”며 “작년에 통과된 예산안이 639조원인데 상반기 중 빨리 많은 금액을 집행하도록 하겠다”고 했다.윤석열 정부의 외교·안보 정책, 이 대표의 검찰 2차 출석 등을 놓고도 여야 충돌은 계속될 전망이다. 민주당은 오는 26일 열릴 국방위원회 전체회의에서 북한 무인기 침투 등 윤석열 정부의 안보 무능을 집중 부각하려고 벼르고 있다. “UAE(아랍에미리트연합)의 주적은 이란” 등 윤 대통령의 순방 실언도 공세하고 있다.국민의힘은 이 대표가 대장동·위례 개발 특혜 의혹 조사를 받기 위해 서울중앙지검에 출석하는 28일을 전후로 사법리스크 총공세를 펼칠 것으로 보인다. 성 의장은 설 연휴에 청취한 민심이라며 “‘당대표로 이렇게 많은 범죄 혐의를 받는 공인을 본 적이 없다’ ‘민주당 (대선) 경선 과정에서 나온 문제를 왜 국민의힘이 정적 제거한다고 하느냐’라고들 한다”고 전했다.이태원 핼러윈 참사 국정조사 후속 조치도 여야 관계의 변수로 남아 있다. 민주당은 이상민 행정안전부 장관의 탄핵소추안 발의 카드를 만지작거리고 있다. 야3당은 독립적 진상조사기구를 꾸리는 특별법 제정을 추진할 것을 촉구했다. 이에 국민의힘은 부정적이다.",탁지영 기자 문광호 기자, 개점 휴업 중인 1월 임시국회,2023-01-24 15:50:00,경향
301,https://www.khan.co.kr/politics/politics-general/article/202301241512001,"국민의힘 당권주자들이 분주한 설 연휴를 보냈다. 당권 경쟁이 크지 않은 지지율 격차 속에 진행되면서 각 주자는 취약층 공략에 나섰다. 김기현 의원은 유기견 봉사활동을 다녀오고 여성 군사기본교육 도입을 주장했다. 중도층과 일부 20대 남성을 겨낭한 행보로 분석된다. 안철수 의원은 북한이탈주민들과 오찬 간담회를 열었고, 연일 윤석열 대통령의 외교 성과를 호평했다. 전통 보수층 구애 전략으로 보인다.김 의원은 24일 서울 여의도 한 식당에서 ‘연포탕’(연대·포용·탕평)이란 이름의 오찬 기자간담회를 열고 “보수당의 뿌리에 근거해 외연을 넓히기 위한 확장성이 필요하다”며 “연대와 포용과 탕평을 통해 당을 하나로 묶어내겠다”고 말했다. 김 의원은 ‘김장연대’(김기현·장제원 의원 연대)의 한 축인 장 의원이 차기 총선 공천권을 휘두를 것이라는 예상에 대해 “선거 과정에서 당직을 약속하거나 그걸 고리로 뭔가를 한다거나 할 생각이 전혀 없다”고 말했다. 김장연대로 인지도와 지지율을 끌어올렸지만 당내 장 의원에 대한 반감도 커지면서 확장성 한계를 우려하는 모양새다.김 의원은 청년·중도층이 관심을 보일 만한 주제를 공략했다. 그는 지난 23일 자신의 사회관계망서비스(SNS)에 글을 올려 여성 군사기본교육 도입을 주장했다. 김 의원은 이날 간담회에서 “여성들의 반발에 대해서는, 모든 제도는 바꾸면 반발하는 분들이 생기게 돼 있다. 반대 의견이 무서워 제대로 바꾸지 않겠다고 하면 아무것도 안하겠다는 것”이라고 말했다. 김 의원은 지난 23일에는 인천 계양구 한 유기견 보호쉼터를 찾아 봉사활동을 했다.김 의원은 청년·중도층의 표심을 적극 공략해야 한다고 판단한 것으로 보인다. 변수가 많은 결선투표를 피하려는 김 의원으로서는 대세론에 부합할 수 있는 압도적 지지율이 필요하다. 특히 자신과 갈등을 빚어온 이준석 전 대표 지지 성향 일부 20대 남성의 표심을 얻어야 한다고 판단한 것으로 보인다. 김 의원은 지난 16일 한 매체에서 “이 전 대표는 대선 과정에서 가출하는 등 사고를 쳤고 넉넉히 이길 수 있는 선거를 질 뻔했다”고 주장했다. 이 전 대표는 같은날 SNS에 “이준석 때문에 질 뻔했다는 분은 그냥 데이터 무시, 민심 무시, 현실 무시하는 것”이라며 “입 씻는 것을 넘어 뒤통수까지 가지는 말자”고 반박했다. 김 의원은 SNS에서 “일각에서 ‘이대남’ 표심을 잡으려고 내놓은 정책이라고 하는데 그렇지 않다”며 “오히려 정치권이 표를 의식해 금기시했던 주제를 제안한 것”이라고 주장했다.안 의원은 취약층인 전통적 보수 지지층 구애에 나섰다. 안 의원은 이날 오전 천영우 전 청와대 외교안보수석과 만나 대화를 나눴다. 이후 여의도 한 식당에서 북한이탈주민과 오찬간담회를 했다. 안 의원은 간담회 뒤 기자들과 만나 “제 목표는 1차에서도 1등하는 후보”라며 “수도권 민심도 잘 알고 중도 표심과 2030 표심을 모을 수 있는 사람, 공천 갈등 등을 잘 관리할 수 있는 사람이 필요하다고 생각하는데 저는 그 세 가지 조건에 다 부합하는 유일한 후보”라고 말했다. 지난 20일에는 전직 대통령 이명박씨를 예방했다.안 의원은 ‘윤심’(윤 대통령 의중)에도 구애했다. 지난 21일과 22일 잇달아 SNS에 “적군이 이순신에게 트라우마가 있듯, 민주당은 윤석열-안철수 콤비를 가장 두려워한다”, “尹·安이(유난히) 잘하는 국민의힘”, “대통령 윤석열, 당대표는 안철수” 등의 글을 올려 친윤석열 행보를 이어갔다. 지난 22일 당 소속 의원들에게 김 의원과의 결선투표 대결시 자신이 앞선다는 한 여론조사 결과를 문자메시지로 발송했다. 안 의원은 지난 23일에는 SNS에서 “윤 대통령의 UAE(아랍에미리트연합) 국빈 방문에 대해 많은 국민들께서 관심을 보이고 있다”며 “윤 대통령은 집중력 있는 노력으로 국빈방문을 성사시켰고 큰 경제외교 성과를 안고 돌아왔다”고 강조했다. 윤 대통령의 ‘UAE 적은 이란’ 발언에 대한 비판을 의식한 듯 “우리나라에서는 이상하게도 타국의 관점을 빌려와 우리의 외교를 평가절하하는 경향이 있다”며 “이는 국익이나 국민통합에 전혀 도움이 되지 않는다”고 윤 대통령을 옹호했다.김 의원과 안 의원은 이날 날선 공방을 벌였다. 김 의원은 기자간담회에서 “‘철새 정치’ ‘여기 기웃 저기 기웃’ 정치인의 삶을 살아오지 않았다”고 말했다. 자신의 연포탕론을 안 의원이 ‘말장난’이라고 비판한 데 대해 “상대 후보에 대해 표현하는 걸 점잖게 했으면 좋겠다”고 말했다. 안 의원은 기자들과 만나 “연포탕을 외치다 그 다음날 갑자기 진흙탕을 외치니 당황스럽다”고 말했다. 전날 김 의원이 “이재명 대표는 사실 흙수저 출신이지 않나. 우리 당 대표도 흙수저 출신인 제가 돼야 맞상대가 된다”고 한 것을 겨냥한 발언이다. 안 의원은 또 “예전에도 ‘김장연대’ 한다고 하고 오랫동안 그걸 유지하기 위해서 김치 냉장고를 산다고도 하다가 하루 만에 (입장을) 바꿨다”며 “상황이나 전략에 따라서 자꾸 이야기가 왔다갔다 바뀌는 것”이라고 말했다.윤상현 의원은 이날 SNS에서 김 의원의 여성 군사기본교육 공약에 대해 “모든 국민의 안전을 위한 민방위 훈련에 대해 남녀를 이렇게 분리하는 건 좋지 않다고 생각한다”며 “김 의원의 이번 공약은 안보 공약이 아니라 젠더 공약이라는 의심을 피할 수 없다”고 말했다. 그는 “당장 윤 대통령이 내건 공약인 여성가족부 폐지에 대해서도 아직 이행하고 있지 못한 실정”이라며 윤 대통령 공약 지원이 우선이라고 주장했다.",문광호 기자 이두리 기자," 김기현 ‘20대 남성과 유기견’, 안철수 ‘안보와 윤심’···당권경쟁 다른 코드",2023-01-24 15:12:00,경향
302,https://www.khan.co.kr/politics/politics-general/article/202301241347001,"국민의힘이 24일 설 민심을 전하며 이재명 더불어민주당 대표에 대한 부정적 여론을 집중 거론했다. 윤석열 대통령의 ‘아랍에리미트연합(UAE) 적은 이란’ 발언과 국민의힘 전당대회 개입 논란 등 정부·여당에 불리한 사안에 대한 민심 전달은 거의 없었다.성일종 국민의힘 정책위의장은 이날 국회에서 연 기자간담회에서 “민주당이 정적제거, 야당파괴, 정치공작, 정치검찰 등 4가지 프레임으로 이 대표의 범죄 의혹과 관련된 혐의에서 벗어나려는 것이 지극히 바람직하지 않다는 것이 설 민심의 대표적인 말씀들이었다”고 말했다. 성 의장은 “이 대표처럼 당 대표로서 이렇게 많은 범죄 혐의를 받는 공인을 본 적이 없다”며 “야당파괴라는 말도 안 되는 정치 프레임으로 국민의힘에 뒤집어씌우려는 전형적인 수법이라는 말들이 있다”고 말했다.성 의장은 또 “(문재인 정부에서) 간첩에 대한 첩보가 보고됐음에도 수사를 방해한 것은 있을 수 없는 국가파괴 행위라는 큰 우려와 걱정이 있었다”며 “특히 대공수사권을 경찰로 이관해 국가정보원을 무력화시키는 건 국가해체 행위와 다름없다”고 주장했다.성 의장은 난방비 폭등 문제와 관련해서는 “추운 겨울을 나는 데 정부가 좀 더 여유가 있고 재정적 여력이 있으면 더 지원해야 하는데 송구스럽다”면서도 “우리만 겪는 게 아니라 전 세계적 현상”이라고 밝혔다. 성 의장은 “문재인 정부에서 가스 가격이 2~3배 오를 때 (요금을) 13%만 인상했다. 모든 부담은 윤석열 정부에 돌아왔다. 전기요금도 마찬가지”라며 “최선을 다해 어려운 계층이 추운 겨울을 나는 데 조금이라도 어려움을 덜 방안을 찾겠다”고 밝혔다.김미애 국민의힘 원내대변인은 이날 논평에서 이날 앞서 열린 민주당의 설 민심 기자간담회를 겨냥해 “설 밥상에 오른 ‘이재명 범죄 리스크’에 대한 국민 비난의 화살을 현 정부로 돌려보려는 ‘설 민심 왜곡 간담회’일 뿐이었다”며 “민주당은 국민을 위해 일해야 하는 본분을 직시하고, 늦었지만 이재명 방탄의 늪에서 빠져나와야 한다”고 주장했다.박정하 국민의힘 수석대변인은 이날 아침 SBS 라디오 <김태현의 정치쇼>에 출연해 설 연휴 동안 “‘화물연대 파업 이후 우리나라가 흔들렸던 것, 최근 간첩 사건이 보도되고 있는데 이런 것들에 대해 흐트러졌던 국가 기강을 바로 세우라’는 이야기를 들었다”고 말했다.김기현 국민의힘 의원은 이날 기자들과의 오찬 간담회에서 “윤 대통령이 일하려고 하는데 왜 자꾸 서로 마음을 잘 못 맞추냐는 지적을 많이 들었다”며 “민주당이 저렇게 나오는데 왜 우리 당이 제대로 대응을 못하냐고 말씀하시더라. 적극적으로 민주당에 대응해 달라는 한결같은 요구가 있었다”고 말했다.노용호 국민의힘 의원은 전날 사회관계망서비스(SNS)에서 “많은 분께서 이 대표에 대한 피로감을 호소하셨다. 뉴스마다 도배되는 불법 의혹들에 대해 제발 법대로 신속 처리해달라고 하신다”며 “새해에는 부디 ‘법대로’ 국민 여러분의 스트레스가 조금이나마 줄어들기를 기대한다”고 썼다.",이두리 기자 문광호 기자, [국민의힘이 전한 설민심] “이재명 대표 피로감 호소”,2023-01-24 13:47:00,경향
