,title,article,news
91,"권성동 ""文의 악담 신년사...망가진 나라, 尹정부가 정상화 중""","권성동 국민의힘 의원은 31일 문재인 전 대통령의 신년사와 관련해 “부디 자중하시며 도를 넘지 마시길 바란다”고 비판했다.        권 의원은 이날 자신의 사회관계망서비스(SNS) 페이스북에 “문 전 대통령이 악담이 가득한 신년사를 내놓았다”며 이 같이 밝혔다.        권 의원은 “이태원 압사 사고를 두고 ‘못난 모습들이 마음까지 춥게 한다’는 둥, ‘경제는 어렵고, 민생은 고단하고, 안보는 불안하다’는 둥, ‘새해 전망은 더욱 어둡다’는 하며 본인의 뒤틀린 심사를 풀어냈다”고 지적했다.      이어 “일국의 대통령까지 지냈으면 최소한 신년 메시지만큼은 정제할 줄 알아야 한다. 어제 이명박 전 대통령은 자택으로 돌아오면서 국가와 국민을 위해 기도하겠다고 했다. 이런 것이 대통령의 품격이다”고 했다.      권 의원은 “문 전 대통령의 악담은 품격이 떨어지는 것은 둘째 치고, 도저히 본인이 쓸 수 없는 언사다”며 “사고 앞에서 못난 모습을 보인 당사자가 문 전 대통령 자신이다. 해양수산부 공무원 월북조작 사건에 대해 여전히 비겁한 변명으로 일관하고 있다”고 꼬집었다.        이어 “집권 5년 동안 경제, 민생, 안보 등 모든 것을 망친 당사자 역시 문 전 대통령”이라며 “국가부채 1천조 시대는 누가 열었습니까? 몰상식한 소주성을 경제기조로 채택한 정부는 어디였습니까”라고 물었다.      그러면서 “허접한 부동산 대책을 수십번 남발하여 주거 난민을 만든 장본인은 누구이며, 역대 대통령 중 가장 북한 앞에서 비굴했던 대통령은 또 누구입니까”라고 강조했다.       



권성동 국민의힘 의원이 지난 12일 오전 서울 여의도 하우스 카페에서 열린 대한민국언론인총연합회 창립 준비위 발족식에서 축사를 하고 있다. 뉴스1           권 의원은 “문 전 대통령이 망친 나라를 윤석열 정부가 정상화하는 중이다”며 “그러니 저급한 훈수는 그만두시길 바란다. 요새 표현대로 ‘어그로’를 끌면서 어떻게 잊혀진 대통령이 되겠습니까”라고 했다.  이어 “솔직히 문 전 대통령이 이재명 (더불어민주)당 대표보다 대한민국에 끼친 해악이 훨씬 크다”며 “이 대표가 ‘권력형 비리’라면, 문 전 대통령은 ‘권력형 망국’ 수준입니다. 이 대표가 나라‘에서’ 해먹었다면, 문 전 대통령은 나라‘를’ 해먹었다고 해도 과언이 아니다”라고 비판했다.        앞서 문 전 대통령은 전날 사회관계망서비스(SNS) 페이스북과 트위터에 공개한 연하장에서 “유난히 추운 겨울이다. 치유되지 않은 이태원 참사의 아픔과 책임지지 않고 보듬어 주지 못하는 못난 모습들이 마음까지 춥게 한다. 경제는 어렵고, 민생은 고단하고, 안보는 불안하다. 새해 전망은 더욱 어둡다”고 밝혔다.",중앙일보
92,"與, 文연하장 직격 ""'갈등 조장' 못된 습관…잊힐까 불안한 모양""","국민의힘은 31일 문재인 전 대통령을 겨냥해 ""국민을 갈라치기하고 갈등을 조장하는데 앞장섰던 대통령답게 퇴임 후 보낸 연하장에서도 갈등과 분열을 조장하는 못된 습관이 고스란히 녹아있다""고 했다.      박정하 수석대변인은 이날 논평을 통해 ""문 전 대통령이 연하장을 자신의 SNS에 올렸다. 잊혀진 삶을 살겠다던 문 전 대통령이 국민들로 하여금 완전히 잊힌 존재가 될까 봐 불안한 모양""이라며 이같이 밝혔다.      박 수석대변인은 ""지난 시절 저지른 내로남불과 통계조작에 사죄하고 자숙해도 모자랄 판에 시시때때로 목적성 목소리를 낸다""며 ""대한민국의 경제를 어렵게 만들고 있는 것은 문 전 대통령의 친정인 민주당""이라고 했다.이어 ""윤석열 대통령의 국정과제를 사사건건 발목 잡고 경제 회복의 마중물을 차단하기 바쁘다""며 ""이태원 참사에 대한 원인과 진상규명을 정쟁으로 이끌며 국민의 슬픔을 철저히 이용한다""고 말했다.그러면서 ""문 전 대통령은 참사의 아픔을 운운하기 전에 아비규환의 현장을 홍보 무대로 활용한 자당 의원에 대해선 왜 침묵하는가""라며 ""사회의 갈등과 분열을 조장하는 전직 대통령의 행태가 참으로 개탄스럽다""고 했다.      박 수석대변인은 ""공식적으로 성명을 내는 결기도 없으면서 뒤에서 궁시렁거리는 모습에 존경심이 생겨날 수 없다""며 ""존경받을 권리마저 스스로 차버린 전직 대통령의 비겁한 위선이 올해의 마지막 날을 씁쓸하게 한다""고 했다.      또 ""풍산개의 겨울이 어느 해 보다 추울 것 같다""며 ""책임지지 않고 보듬어 주지 못한 문 전 대통령이 버린 곰이와 송강이 말""이라고 덧붙였다.      문 전 대통령은 전날인 30일 공개한 신년 연하장에서 ""유난히 추운 겨울이다. 치유되지 않은 이태원 참사의 아픔과 책임지지 않고 보듬어 주지 못하는 못난 모습들이 마음까지 춥게 한다""고 밝혀 윤석열 정부의 참사 대응을 비판한 게 아니냐는 해석이 나왔다.",중앙일보
93,"“올해 기록적 미사일 쏜 北, 마지막 날 3발 더 보태”","올해 마지막 날인 31일에도 미사일 도발을 감행한 북한과 관련해 “북한의 올해 기록적인 미사일 발사에 마지막 한 번의 공세가 추가됐다”며 외신들이 이날 긴급뉴스로 보도했다.  AFP통신은 북한이 이날 오전 8시쯤 동해상으로 단거리탄도미사일(SRBM) 3발을 발사했다며 “북한이 역대 가장 강력한 대륙간탄도미사일(ICBM)을 발사하는 등 거의 매달 무기 시험에 나서면서 2022년 한반도의 군사적 긴장감이 급격히 고조됐다”고 평가했다.      그러면서 양무진 북한대학원대 총장의 발언을 인용해 “이날 북한의 미사일 발사는 한국의 고체연료 추진 우주발사체 시험비행에 대응하는 게 목적이다. 북한은 이를 경쟁이라고 생각하고 있는 것 같다”고 통신이 분석했다.      로이터통신도 이번 미사일 발사에 대해 “올해 북한이 실시한 유례없는 규모의 미사일 시험 중 마지막 하나”라며 “(북한이) 7차 핵실험을 감행할 수 있다는 추측 속에 무기 개발을 계속 추진하고 있다”고 설명했다. 이어 “북한과 한미 동맹 간 긴장 관계는 윤석열 대통령이 집권한 지난 5월부터 고조돼 왔다”라고도 평가했다.        블룸버그통신은 북한이 신년 국정 방향을 논의하는 노동당 중앙위원회 전원회의 도중 미사일 발사를 감행했다는 점에 주목했다. 통신은 “(회의 도중 김정은 북한 국무위원장이) 3년가량 교착 상태에 빠진 비핵화 논의에 관심을 보이지 않았고, 핵무기를 절대 포기하지 않겠다고 약속했다”며 “북한은 2017년 이후 첫 핵실험으로 역내 긴장을 고조시킬 것으로 보인다”고 내다봤다.        북한은 올해 1월 5일 자강도 일대에서 동해상으로준중거리탄도미사일(MRBM)급 극초음속미사일 발사를 시작으로 이날까지 최소 33차례에 걸쳐 약 70발의 탄도미사일을 발사했다. 순항 미사일도 3차례 발사했다. 7월 제외한 모든 달에 미사일을 발사한 것으로도 알려졌다.      특히 지난 26일엔 북한 무인기 5대가 우리 영공을 침범하고 그중 1대는 서울까지 진입해 인천공항과 김포공항에선 여객기 수십편이 1시간가량 일시 이륙 중단됐다.",중앙일보
94,유승민 “새해엔 분열 아닌 통합의 정치…개혁 성공 보장할 것”,"유승민 전 국민의힘 의원은 31일 새해를 앞두고 “당장의 위기 속에서도 대한민국의 밝은 미래를 위한 개혁에 나서야 한다”며 ‘통합의 정치’를 강조했다.유 전 의원은 이날 페이스북을 통해 “새해는 인구, 연금, 건강보험, 노동, 교육의 5대 개혁을 시작하는 한 해가 되어야 한다”며 이같이 밝혔다.        유 전 의원은 “새해 우리의 최대 목표는 어떻게 경제위기를 극복하고 민생을 안정시키느냐(다)”라며 “민생경제의 위기 속에서 하루하루를 힘들게 버티고 살아가시는 국민들을 따뜻한 복지안전망으로 보호하는 것은 국가의 당연한 책무”라고 했다.       그러면서 “정부와 국민이 함께, 기업과 노동자가 함께, 노령층과 청년층이 함께, 여와 야가 함께 대화하고 이해하고 설득하는 과정을 거쳐야 개혁에 합의하고 개혁을 추진할 수 있음을 명심해야 한다”며 ‘분열의 정치’가 아닌 ‘통합의 정치’가 “개혁의 성공을 보장할 것”이라고 강조했다.        유 전 의원은 “지금보다 더 나은 세상을 만드는 것이 정치의 소명”이라며 “새해에는 우리 정치가 봄날의 햇살과 같은 희망을 국민들께 드릴 수 있도록 정치부터 변화가 시작되기를 희망한다”고 했다.",중앙일보
95,"이재명 신년사 ""권력 도취된 정권의 무능∙오만 좌시하지 않겠다""","이재명 더불어민주당 대표가 2023년 계묘년 새해를 앞두고 ""찰나에 불과한 권력에 도취된 정권의 무능, 오만, 무책임을 좌시하지 않겠다""며 ""국민과 함께 다시 한번 승리의 진군을 시작하겠다""고 밝혔다.       이 대표는 31일 신년사를 통해 ""민주당은 민생과 민주주의 수호의 방패를 들고 개혁의 칼을 곧추세워 국민과 대한민국을 지키겠다""며 이같이 말했다.        이 대표는 ""민주주의를 말살시키고 있는 검찰 정권의 야당 파괴, 정치보복 폭주가 멈출 기미를 보이지 않고 있다. 한반도 평화가 흔들리고 있지만, 정부는 아무런 해법도 없다""며 ""국민께서 힘겹게 쌓아 올리고 다져온 민생, 민주주의, 평화의 토대가 사방에서 무너지고 있다""고 지적했다.       이어 ""어둠이 깊어질수록 새벽은 가까워지는 법""이라며 ""지금 마주한 위기도 더 큰 도약을 위한 기회가 될 수 있다. 시련과 역경을 늘 새로운 변화의 계기로 탈바꿈시켜왔던 우리 국민의 위대한 저력이 있기 때문""이라고 말했다.       그러면서 ""이를 위해 무엇보다 정치가 달라져야 한다""며 ""국민과 국가를 위해서만 사용되어야 하는 권력을 정권의 사적 욕망을 위해 악용하는 잘못을 더는 용납해선 안 된다""고 강조했다.      이 대표는 ""백척간두에 놓인 민생경제를 구하고, 검찰 독재정권의 일탈을 저지하며, 한반도 평화와 대한민국의 더 나은 미래를 열겠다""고 밝혔다.       특히 ""정전협정 체결 70주년인 올해 동북아 평화공동체 시대를 개막하고, 기후변화와 디지털 대전환, 인구구조 급변 같은 위기를 대도약의 기회로 만들 청사진도 마련하겠다""며 ""모든 국민이 기본적인 삶을 보장받는 기본사회로 한발 더 나아가겠다""고 덧붙였다.       끝으로 이 대표는 ""민주당의 존재 이유도, 저 이재명의 정치적인 소명도 오직 '국민주권(國民主權)'이고 또한 국민의 삶""이라며 ""그 길을 국민과 함께 흔들림 없이 걷겠다. 어떤 고난에도 굴하지 않고 국민을 위해 싸우겠다""고 말했다.",중앙일보
96,한 총리 “민생경제 회복에 전력…지혜·힘 모으면 위기 극복”,"한덕수 국무총리는 31일 “새해에는 더 안전한 대한민국에서 국민이 행복한 일상을 되찾을 수 있도록 정부는 최선의 노력을 다하겠다”며 “지혜와 힘을 모으면 지금의 위기를 반드시 극복할 수 있을 것”이라고 강조했다.  한 총리는 이날 신년사를 통해 “글로벌 경기 침체와 고물가, 고금리의 경제위기 속에서 이태원의 비극적인 참사로 인해 우리 모두 큰 아픔을 겪었다”며 이같이 밝혔다.      한 총리는 “무엇보다 민생경제 회복에 전력을 다하겠다”라며 “부동산 시장 안정화 등 적극적인 정책과 과감한 규제개혁으로 경제에 새로운 활력을 불어넣겠다”고 했다. 특히 “노동, 교육, 연금 등 3대 구조개혁과 금융, 서비스, 공공 등 3대 분야 혁신을 강력히 추진하겠다”고 강조했다.      이 밖에도 지속 가능한 성장, 복지 사각지대 해소 및 취약계층 지원 강화, 균등한 기회의 지방시대, 국방력을 바탕으로 한 북한 도발 대응 등에도 최선을 다하겠다고도 했다.      한 총리는 “새해에도 국내외 상황은 매우 엄중하다”면서도 “그러나 우리의 지혜와 힘을 모으면 지금의 위기를 반드시 극복할 수 있을 것”이라고 강조했다.       한 총리는 그러면서 “이를 위해 우리 모든 공직자는 국민만 바라보며 국민과 함께 뛰겠다. 검은 토끼의 영민함과 민첩함으로 대한민국이 새롭게 도약할 수 있기를 소망한다”며 “2023년 계묘년 새해, 성장과 풍요의 상징인 토끼처럼 여러분의 가정에 건강과 행복이 가득하기를 기원한다”고 덧붙였다.",중앙일보
97,"北미사일 도발에…與 ""文정권 헛소리"" 野 ""군 미필 尹 무모""","올해 마지막 날인 31일에도 북한이 단거리탄도미사일(SRBM) 도발을 감행한 것을 두고 근본적인 원인으로 국민의힘은 “도발에 평화를 운운하며 헛소리하는 지난 정권”을 꼽은 반면 더불어민주당은 “군 미필 대통령의 무모한 초강경 발언” 때문이라고 주장했다. 박정하 국민의힘 수석대변인은 이날 논평을 통해 “도발에 평화를 운운하며 헛소리하는 지난 정권에 잘못 길든 북한에는 단호한 대응만이 답”이라며 이같이 밝혔다.      박 수석대변인은 “(지금은) 우리 국민이 북한에 피격당하고 태워지는 끔찍한 사건이 발생해도 말 한마디 못 했던 비겁한 정권이 아니라는 것”이라며 “새 정부 탄생 후 그간 축소됐던 한미 훈련이 강화되고, 대북 확장 억제에 대한 국제사회의 공조도 어느 때보다 공고하다”고 했다.      이어 “우리 국민의 안위를 위협하는 북한의 도발은 스스로 고립을 심화시키는 자해행위라는 점을 분명히 하며, 도발에는 혹독한 대가가 따를 것을 엄중히 경고한다”고 강조했다.      하지만 이경 더불어민주당 상근부대변인은 이날 논평을 내고 “군 미필 대통령의 무모한 초강경 발언들이 군사적 긴장을 촉발하고 있다”며 현 정부를 겨냥했다.      이 부대변인은 “윤석열 정부가 북의 도발에 맞서 발언 수위만 높이고 있으니 국민은 불안하다”며 “대응책도 마련하지 않는 강경 일변도의 즉자적 대응을 멈춰야 한다. 군사적 긴장만 고조시킬 뿐”이라고 했다.      그러면서 북한을 향해서도 “군사적 도발을 멈출 것을 촉구한다”며 “북한이 한반도의 군사적 긴장을 높여 얻을 수 있는 것은 고립 외에는 아무것도 없음을 분명히 경고한다”고 목소리를 높였다.      북한은 이날 오전 8시쯤부터 황해북도 중화군 일대에서동해상으로 3발의 단거리탄도미사일(SRBM)을 발사했다.",중앙일보
98,"여야, 베네딕토 16세 전 교황 선종에 애도","여야는 31일 베네딕토 16세 전 교황의 선종 소식에 한목소리로 애도를 표했다.국민의힘 박정하 수석대변인은 이날 논평을 통해 “현세에서의 삶에 집착하는 신도의 모습이 아닌, 순례자로서 마지막까지 살아온 모습은 앞으로도 모든 가톨릭 신도에게 기억될 것”이라며 “깊은 애도를 표한다”고 밝혔다.      박 수석대변인은 “베네딕토 16세는 무려 598년 만에 스스로 권좌에서 내려온 교황으로 가톨릭 쇄신의 상징이 됐다”며 “급변하는 세상에서 가톨릭 교리를 수호하는 데 전력했다”라고 평가했다.      더불어민주당 박성준 대변인도 서면 브리핑에서 “교회의 전통을 되살리는 데 힘쓴 교황이자 선종 때까지 교황의 자리를 지키는 전통을 깬 교황이기도 하다”며 “종교적으로는 보수적이었지만 사회 문제들에 대해서는 열린 자세를 취하기도 했다”고 밝혔다.      박 대변인은 “우리와도 각별한 인연이 있다. 정진석 대주교를 추기경으로 임명했으며, 평화로운 수단을 통한 한반도 비핵화를 촉구했고 남북 이산가족 재결합을 위해 기도하겠다는 뜻을 밝히기도 하셨다”며 “선종에 애도를 표하며 슬픔에 잠긴 전 세계 가톨릭 신자들에게 깊은 위로의 마음을 전한다”고 덧붙였다.      베네딕토 16세는 이날 바티칸에서 95세로 선종했다. 2005년 4월 요한 바오로 2세에 이어 제265대 교황직에 올랐던 베네딕토 16세는 교황직에 오른 지 8년 만인 2013년 2월 건강 문제로 더는 베드로의 직무를 수행할 힘이 없다며 스스로 자리에서 물러났다.",중앙일보
99,"尹 ""잊지 못할 마지막 삼종기도""…베네딕토 16세 전 교황 애도","베네딕토 16세 전 교황의 선종 소식에 윤석열 대통령은 ""올바른 교리와 교회 정립을 위해 평생을 헌신하셨다""며 애도를 표했다.       윤 대통령은 31일 자신의 페이스북에 ""20세기 최고의 가톨릭 신학자였던 그분의 신앙과 학문, 인품과 신념의 깊이는 천주교인뿐 아니라 모든 종교인으로부터 존경받는 이유였다""고 말했다.      이어 ""교황님의 사목 표어였던 '진리의 협력자'에서 알 수 있듯이 올바른 교리와 교회 정립을 위해 평생을 헌신하셨다""며 ""시민들에게 다가서서 희망과 용기를 전하는 데도 주저함이 없는 분이었다""고 했다.       아울러 ""대한민국의 앞날을 위해 진심으로 기도해주셨고, 한반도 평화에 앞장서셨다""면서 ""'주께서 내게 더 기도에 힘쓰라며 산에 오르라 하셨다'던 교황님의 마지막 삼종기도 말씀은 잊지 못할 것""이라고 강조했다.       윤 대통령은 ""베네딕토 16세 명예 교황님의 명복을 빌며, 거인을 잃은 슬픔에 잠긴 천주교인들에게도 깊은 애도를 표한다""고 전했다.",중앙일보
0,北 도발에…與 “文정권이 잘못 길들여” vs 野 “尹이 긴장 촉발”,"





김정은 북한 국무위원장. /뉴스1										북한이 2022년 마지막 날인 31일 동해상에 단거리 미사일을 쏘며 도발한 것에 대해 여야가 책임공방을 벌였다.박정하 국민의힘 수석대변인은 이날 논평을 통해 “지난 정권에 잘못 길들여진 북한에는 단호한 대응만이 답이다”라며 문재인 정권 책임론을 제기했다. 반면 이경 더불어민주당 상근부대변인은 논평을 통해 “군 미필 대통령의 무모한 초강경 발언들 역시 군사적 긴장을 촉발하고 있다”며 윤석열 대통령 책임론을 제기했다.박정하 대변인은 “새 정부 탄생 후 그간 축소됐던 한미 훈련이 강화되고, 대북 확장 억제에 대한 국제사회의 공조도 어느 때보다 공고하다”며 “이런 상황에서 북한이 하루가 멀다고 도발을 자행하는 것은 김정은(북한 국무위원장) 스스로 자신의 위기를 인식하고 있다는 방증으로 보인다”고 했다.박정하 대변인은 “과거의 대한민국이 아니다. 우리 국민이 북한에 피격당하고 태워지는 끔찍한 사건이 발생해도 말 한마디 못 했던 그런 비겁한 정권이 아니라는 것이다”라며 “도발에 평화를 운운하며 헛소리하는 지난 정권에 길들여진 북한에는 단호한 대응만이 답이다. 우리 국민의 안위를 위협하는 북한의 도발은 스스로 고립을 심화시키는 자해행위라는 점을 분명히 하며, 도발에는 혹독한 대가가 따를 것임을 엄중 경고한다”고 했다.이경 부대변인은 “북한에 군사적 도발을 멈출 것을 촉구한다. 북한이 한반도의 군사적 긴장을 높여 얻을 수 있는 것은 고립 외에는 아무것도 없음을 분명히 경고한다”면서도 “군 미필 대통령의 무모한 초강경 발언들 역시 군사적 긴장을 촉발하고 있다. 결과가 어떻게 되든 힘겨루기를 하겠다는 것인가”라고 했다.이경 부대변인은 “윤석열 정부가 북의 도발에 맞서 발언 수위만 높이고 있으니 국민은 불안하다”며 “대응책도 마련하지 않는 강경 일변도의 대응을 멈추시라. 군사적 긴장만 고조시킬 뿐이다. 안보 컨트롤 타워인 국가안전보장회의를 가동하고 군사 전문가들의 의견을 수렴해 안보 전략부터 가다듬는 것이 먼저”라고 했다.

",조선일보
1,"여야, 베네딕토 16세 전 교황 선종에 한목소리 애도","





악수하는 프란치스코(오른쪽) 교황과 베네딕토 16세 전 교황의 손. 베네딕토 16세는 31일 바티칸에서 선종했다. /AP 연합뉴스										여야는 31일 베네딕토 16세 전 교황의 선종 소식에 애도를 표했다.국민의힘 박정하 수석대변인은 논평을 통해 “현세에서의 삶에 집착하는 신도의 모습이 아닌, 순례자로서 마지막까지 살아온 모습은 앞으로도 모든 가톨릭 신도에게 기억될 것”이라며 “깊은 애도를 표한다”고 밝혔다.박 수석대변인은 “베네딕토 16세는 무려 598년 만에 스스로 권좌에서 내려온 교황으로 가톨릭 쇄신의 상징이 됐다”며 “급변하는 세상에서 가톨릭 교리를 수호하는 데 전력했다”라고 했다.



국민의힘과 더불어민주당 로고. /조선일보DB										더불어민주당 박성준 대변인도 서면 브리핑에서 “교회의 전통을 되살리는 데 힘쓴 교황이자 선종 때까지 교황의 자리를 지키는 전통을 깬 교황이기도 하다”며 “종교적으로는 보수적이었지만 사회 문제들에 대해서는 열린 자세를 취하기도 했다”고 밝혔다.박 대변인은 “우리와도 각별한 인연이 있다. 정진석 대주교를 추기경으로 임명했으며, 평화로운 수단을 통한 한반도 비핵화를 촉구했고 남북 이산가족 재결합을 위해 기도하겠다는 뜻을 밝히기도 하셨다”며 “선종에 애도를 표하며 슬픔에 잠긴 전 세계 가톨릭 신자들에게 깊은 위로의 마음을 전한다”고 했다.

",조선일보
