,title,article,news
99,“국민 지키기 위해… 실전같은 훈련 게을리하지 않겠다”,"

[제13회 위국헌신상] 국방부·本紙 위국헌신상 시상식



위국헌신상 수상자들이 27일 서울 용산구 국방부 청사에서 열린 시상식에 참석한 뒤 기념 사진을 찍고 있다. 왼쪽부터 김종열 해군 작전사령부 준위, 전재성 해병대 제1사단 상사, 권세정 육군 제2군단 중령, 고 이언달 육군 원사 아내 김은정씨, 심규용 공군 제53 특수비행전대 중령, 유현호 국방부 전력자원관리실 중령. /장련성 기자										국방부와 조선일보가 공동으로 제정한 위국헌신상 제13회 시상식이 27일 서울 용산구 국방부 청사에서 열렸다. 공군 특수비행팀 ‘블랙이글스’가 세계 최대 군사 에어쇼에서 대상과 최우수상을 받는 데 기여한 심규용 공군 중령 등 5명이 본상을 받았다. 행사는 북한 군용 무인기가 전날 우리 영공(領空)을 침범하는 도발을 벌인 점 등을 고려해 식 순서를 간소화하고 엄숙한 분위기에서 진행됐다. 특별상은 해상 침투 훈련 기간 잠수 훈련을 하던 중에 순직한 육군 제 1공수특전여단 1대대 고(故) 이언달 원사가, 한미동맹상은 한미연합군사령부 에슐리 랜스 크레이그 중령이 받았다. 위국헌신상은 2010년 안중근(安重根·1879~1910) 의사 순국 100주년을 맞아 나라 지키는 일에 헌신하고 있는 군인과 국방 분야 종사자들의 노고를 기리기 위해 제정됐다. 안중근 의사가 뤼순(旅順) 감옥에서 순국하기 직전 남긴 ‘위국헌신(爲國獻身) 군인본분(軍人本分)’이란 유묵(遺墨)에서 이름을 따왔다.수상자들은 이날 “상황이 엄중한 만큼 ‘군은 국민의 생명과 재산을 지키는 최후의 보루’라는 말을 다시 한번 마음에 새기고, 주어진 자리에서 본분을 다하겠다”고 말했다. 심규용 중령은 “이번 상은 우리 공군의 전투 조종 능력을 전 세계에 보여준 ‘블랙이글스’팀 전원에게 주는 것으로 생각한다”면서 “실전과 같은 훈련을 게을리하지 않겠다”고 말했다. 그가 속한 블랙이글스팀은 해외 공군으로는 처음으로 이집트 피라미드 상공에서 에어쇼를 펼치며 국위를 선양했다.전재성 해병대 1사단 상사는 올 9월 태풍 ‘힌남노’로 포항에 수해가 났을 때 한국형 상륙돌격장갑차(KAAV) 조종수로 시민을 구조했다. 전 상사는 “앞으로도 해병대는 최전방에서 적대 세력에 맞서 나라를 지키면서도 수해 등 재난이 발생했을 때는 국민을 위해 어디든 달려가겠다”고 했다.해난구조전문부대의 심해잠수사인 김종열 해군 작전사 특수전전단 준위는 2010년 천안함 폭침, 2014년 세월호 침몰 현장에 투입돼 활약했다. 2012년 북한이 발사한 장거리미사일 은하 3호 탐색 회수 작전에서도 엔진 등 많은 미사일 핵심 부품 잔해를 인양하는 성과도 올렸다. 김 준위는 “열악한 환경에서도 최선의 결과를 내려고 모든 것을 바치며 근무하는 동료들이 생각이 난다”며 “수상의 영광을 동료 대원들, 그리고 이 대원들의 헌신을 묵묵히 받쳐준 이들의 가족들에게 돌린다”고 말했다.국방부 재난안전관리총괄담당인 유현호 육군 중령은 코로나 유행 가운데 군 백신 수송을 기획하고 백신수송지원본부 창설에 기여했다. 위국헌신상 심사위원단은 “군과 국민이 일상을 회복할 수 있도록 최전선에서 임무를 수행한 점을 높이 평가했다”고 말했다. 한미동맹상을 받은 크레이그 중령은 이날 긴급 업무로 시상식에는 불참했다. 그는 2차례에 걸쳐 총 5년간 주한미군에 근무하며 한미연합 전투력 향상과 전시작전 계획 발전에 이바지했다.특별상을 받은 고 이언달 육군 원사는 올 7월 잠수 훈련 중 불의의 사고로 순직했다. 이날 상을 대신 받은 아내 김은정씨는 행사 후 소감을 묻는 기자에게 “생의 마지막 순간까지도 군인으로서 본분을 다하다 간 우리 아저씨가 존경스럽다”면서 “사랑합니다. 여보”라고 말했다. 이내 눈시울이 붉어졌지만, 곁에 서 있는 두 아들과 딸 등 세 자녀를 바라보며 미소를 지었다. 세 자녀는 “아버지가 자랑스럽다” “본받아 훌륭한 사람이 되겠다”고 했다.이종섭 국방부 장관은 축사에서 “위국헌신상은 군인에게 가장 영예로운 상”이라면서 “군은 앞으로도 장병들의 헌신이 ‘힘에 의한 평화’로 구현될 수 있도록 혼신의 노력을 다하고 장병들이 자부심과 긍지를 가지고 복무할 수 있도록 합당한 예우와 보상 체계를 더욱 발전시키겠다”고 말했다.방상훈 조선일보 사장은 인사말에서 “북한은 올들어 선제 핵타격을 법제화하고 ‘괴물 ICBM’(대륙간탄도미사일)으로 불리는 화성-17형 시험 발사에 사실상 성공하는 등 위기감을 최고조로 끌어올리고 있다”면서 “전쟁은 없어야겠지만, ‘평화를 원하거든 전쟁에 대비하라’는 격언이 더욱 가슴에 와닿는 때”라고 했다. 그러면서 “우리의 생존 전략과 안보 역량에 대한 고민이 깊어지는 상황이기에 올해 위국헌신상은 더욱 각별한 의미가 있다”고 했다.



 

",조선일보
1," 이재명 신년사 “권력에 도취된 정권의 무능, 오만, 무책임 좌시 않겠다”","
이재명 더불어민주당 대표가 2023년 새해를 맞아 “찰나에 불과한 권력에 도취된 정권의 무능, 오만, 무책임을 좌시하지 않겠다”고 밝혔다.
이 대표는 31일 공개한 신년사에서 “더불어민주당은 2023년 올해, 국민과 함께 다시 한번 승리의 진군을 시작하겠다”면서 “민생과 민주주의 수호의 방패를 들고 개혁의 칼을 곧추세워 국민과 대한민국을 지키겠다”고 했다.
이 대표는 “민주주의를 말살시키고 있는 검찰정권의 야당파괴, 정치보복 폭주가 멈출 기미를 보이지 않고 있다”면서 윤석열 정부를 겨냥했다. 그는 “국민과 국가를 위해서만 사용되어야 하는 권력을 정권의 사적 욕망을 위해 악용하는 잘못을 더는 용납해선 안 된다”고 주장했다.
이 대표는 “백척간두에 놓인 민생경제를 구하고, 검찰 독재 정권의 일탈을 저지하며, 한반도 평화와 대한민국의 더 나은 미래를 열겠다”면서 새해 포부를 밝혔다. 그는 “반쪽자리 평화를 끝내고 동북아 평화공동체 시대를 개막하겠다. 기후변화와 디지털 대전환, 인구구조 급변 같은 위기를 대도약의 기회로 만들 청사진도 마련하겠다”고 했다.
이 대표는 “새로운 한 해를 시작하며 ‘대한민국의 주권은 국민에게 있고, 모든 권력은 국민으로부터 나온다’는 헌법 1조를 다시 한번 새겨본다”면서 “민주당의 존재 이유도, 저 이재명의 정치적인 소명도 오직 ‘국민주권’이고 또한 국민의 삶”이라고 했다. 그는 “그 길을 국민과 함께 흔들림 없이 걷겠다. 어떤 고난에도 굴하지 않고 국민을 위해 싸우겠다”고 덧붙였다.
이 대표는 새해 첫날 경남 김해 봉하마을을 찾아 노무현 전 대통령 묘역을 참배하고 권양숙 여사를 예방한다. 다음날 경남 양산 평산마을을 찾아 문재인 전 대통령을 예방한다.",경향
2, [신년사] 한덕수 “민생경제 회복 전력···노동·교육·연금개혁 강력 추진”,"
한덕수 국무총리가 31일 신년사에서 “특히 노동, 교육, 연금 등 3대 구조개혁과 금융, 서비스, 공공 등 3대 분야 혁신을 강력히 추진해나가도록 하겠다”고 밝혔다.
한 총리는 이날 배포한 ‘2023년 계묘년 신년사’에서 “무엇보다 민생경제 회복에 전력을 다하겠다”며 이같이 밝혔다.
한 총리는 “중소기업과 소상공인 지원, 부동산 시장 안정화 등 적극적인 정책과 과감한 규제개혁으로 우리 경제에 새로운 활력을 불어넣겠다”고 밝혔다.
한 총리는 “미래 성장동력을 확충하고 민간 중심으로 경제를 활성화하여 우리 경제의 지속 가능한 성장을 이뤄나가겠다”고 밝혔다.
한 총리는 “또한 복지 사각지대를 해소하고 취약계층에 대한 지원은 한층 더 두텁게 강화하여 따뜻한 사회를 만들어가겠다”고 했다.
한 총리는 “국민 누구나 어디서 살든 균등한 기회를 가질 수 있는 지방시대를 열어가겠다”며 “굳건한 한·미 동맹과 강력한 국방력을 바탕으로 북한의 도발에 대응하면서 한반도의 평화를 지키는 데 최선을 다할 것”이라고 밝혔다.
한 총리는 그러면서 “국제사회와 적극적인 연대와 협력을 통해 기후 위기, 디지털 격차 등 글로벌 현안에 대한 우리의 역할과 책임을 다하겠다”고 했다.
한 총리는 “새해에도 국내외 상황은 매우 엄중하다”며 “그러나 우리의 지혜와 힘을 모으면 지금의 위기를 반드시 극복할 수 있을 것”이라고 강조했다. 그는 “이를 위해 우리 모든 공직자는 국민만 바라보며 국민과 함께 뛰겠다”고 했다.
한 총리는 “지난 한해는 참으로 힘든 시간이었다”며 “글로벌 경기 침체와 고물가, 고금리의 경제위기 속에서 형언할 수 없는 이태원의 비극적인 참사로 인해 우리 모두 큰 아픔을 겪었다”고 했다.
한 총리는 “올 한 해, 성장과 풍요의 상징인 토끼처럼 여러분의 가정에 건강과 행복이 가득하기를 기원한다”며 “검은 토끼의 영민함과 민첩함으로 대한민국이 새롭게 도약할 수 있기를 소망한다”고 밝혔다.",경향
3, 문재인 전 대통령 새해 인사에···국민의힘 “비겁한 위선” “어그로” 비판,"
문재인 전 대통령이 지난 30일 게시한 신년 연하장에 대해 국민의힘이 “존경받을 권리마저 스스로 차버린 전직 대통령의 비겁한 위선”이라며 적극 비판했다.
박정하 국민의힘 수석대변인은 31일 논평을 통해 “국민을 갈라치기 하고 갈등을 조장하는 데 앞장섰던 대통령답게 퇴임 후 보낸 연하장에서도 갈등과 분열을 조장하는 못된 습관이 고스란히 녹아있다”며 “이태원 참사에 대한 원인과 진상규명을 정쟁으로 이끌며 국민의 슬픔을 철저히 이용한다”고 밝혔다.
전날 문 전 대통령이 페이스북과 트위터 등 사회관계망서비스(SNS)에 올린 연하장에서 ‘이태원 핼러윈 참사’를 언급하며 “치유되지 않은 이태원 참사의 아픔과 책임지지 않고 보듬어주지 못하는 못난 모습들이 마음까지 춥게 한다”고 말한 데 대한 반박이다.
박 대변인은 문 전 대통령이 “경제는 어렵고, 민생은 고단하고, 안보는 불안하다”고 쓴 데 대해서는 “대한민국의 경제를 어렵게 만들고 있는 것은 문 대통령의 친정인 민주당”이라고 화살을 돌렸다.
이어 “풍산개의 겨울이 어느 해보다 추울 것 같다. 책임지지 않고 보듬어주지 못한, 문 대통령이 버린 곰이와 송강이 말이다”라고 했다. 곰이와 송강은 2018년 김정은 북한 국무위원장이 문재인 당시 대통령에게 선물한 풍산개들로, 현행법상 대통령기록물로 분류된다. 전임 대통령이 위탁 관리하려면 시행령을 개정해야 했지만 개정이 지연되면서 지난달 문 전 대통령은 풍산개들을 대통령기록관에 ‘반환’하겠다는 의사를 밝혔다. 국민의힘은 대통령이 사육비 문제로 반려동물을 파양한다며 비판해 왔다. 곰이와 송강은 대통령기록관의 요청으로 광주 북구 우치공원동물원에서 지내고 있다.
‘윤핵관’(윤석열 대통령 측 핵심관계자) 3인방 중 당권주자인 권성동 국민의힘 의원도 이날 페이스북 게시글을 통해 문 전 대통령의 새해 인사를 강도 높게 비판했다. 권 의원은 “문 전 대통령이 악담이 가득한 신년사를 내놓았다”며 “어제 이명박 전 대통령은 자택으로 돌아오면서 국가와 국민을 위해 기도하겠다고 했다. 이것이 대통령의 품격”이라고 했다. 지난 28일 윤석열 대통령의 신년 특별사면으로 사면·복권된 전직 대통령 이명박씨는 서울 강남구 자택 앞에서 “대한민국의 번영을 위하고 대한민국을 위해서 기도함으로써 역할을 하겠다”고 말했다. 권 의원은 이날 이씨를 밀착 수행했다.
권 의원은 이어 “문 전 대통령이 망친 나라를 윤 정부가 정상화하는 중”이라며 “저급한 훈수는 그만두시길 바란다. 요새 표현대로 ‘어그로’를 끌면서 어떻게 잊혀진 대통령이 되겠나”라고 했다.",경향
4, 한미일 북핵대표 “북 미사일 규탄…중국과 소통 강화”,"
한미일 북핵 수석대표가 31일 3자 유선협의를 하고 북한의 탄도미사일 발사를 강력히 규탄했다.
외교부에 따르면 이날 김건 한반도평화교섭본부장은 성김 미국 대북특별대표, 후나코시 다케히로 일본 북핵수석대표와 통화했다.
이들은 북한이 지난 1월5일을 시작으로 전례 없는 빈도의 미사일 도발을 거듭해온 데 이어, 올해 마지막 날까지 탄도미사일 발사를 감행한 것을 규탄했다.
이어 북한의 ‘도발 일상화’ 전술은 결코 성공할 수 없으며, 유엔 안전보장이사회 결의를 위반하는 어떠한 도발도 국제사회의 단호한 대응에 직면하게 될 뿐이라고 강조했다.
또 북한이 주민의 고통과 민생은 외면한 채 핵·미사일 개발에 재원을 낭비할수록 이에 대한 국제사회의 비난은 더욱 커질 것이라고 경고했다.
3국 수석대표는 굳건한 한미 연합방위태세와 한미일 안보협력을 바탕으로 대북 억제력을 더욱 강화해 나가는 가운데, 북한의 어떠한 추가 도발 가능성도 철저히 대비하겠다고 밝혔다.
특히 이들은 북한의 도발을 억제하기 위한 중국의 건설적 역할이 중요하다는 데 인식을 같이하고, 중국과의 소통을 강화해 나가기로 했다.",경향
5," 북, 동해로 단거리탄도미사일 3발 발사…남 ‘고체 발사체’ 대응 성격","
북한이 31일 동해상으로 단거리탄도미사일(SRBM) 3발을 발사했다. 전날 우리 군의 고체 미사일 발사에 대한 대응 성격으로 보인다.
합동참모본부는 이날 오전 8시 1분쯤부터 북한이 황해북도 중화군 일대에서 동해상으로 발사한 단거리탄도미사일 3발을 포착했다고 밝혔다.
3발 모두 이동식발사차량(TEL)에서 발사돼 북동쪽으로 350여㎞를 비행해 동해에 있는 알섬에 탄착했다.
일본 당국에 따르면 3발의 발사 시각은 8시 1분, 14분, 15분이다.
발사 원점인 황해북도 중화군은 평양에서 남쪽으로 60㎞가량 떨어진 곳으로, 탄도미사일 관련 활동은 처음 포착됐다.
합참 관계자는 “발사 원점, 발사 간격, 비행거리 등 여러 가지 탐지 제원과 내부 정보를 바탕으로 북한의 의도를 분석하고 있다”고 말했다.
북한의 탄도미사일 도발은 지난 23일 평양 순안 일대에서 고체 추진 단거리탄도미사일 2발을 쏜 지 8일 만이다. 이날 발사는 우리 군이 전날 고체연료 추진 우주발사체 시험비행에 성공한 데 대한 맞대응 성격으로 보인다.
합참은 북한의 탄도미사일 발사는 한반도는 물론 국제사회의 평화와 안정을 해치는 중대한 도발행위이자 유엔 안전보장이사회 결의를 명백히 위반한 행위라고 규탄하고 즉각 중단을 촉구했다.
합참은 “우리 군은 북한의 추가 도발에 대비해 한미 간 긴밀한 공조 하에 관련 동향을 추적 감시하면서, 북한의 어떠한 도발에도 압도적으로 대응할 수 있는 능력을 기초로 확고한 대비태세를 유지해 나갈 것”이라고 밝혔다.
북한이 한해 결산·총화를 진행하는 연말에 도발을 지속하는 건 드문 일이다.
북한은 전날 신년 국정방향을 논의하는 노동당 중앙위원회 제8기 제6차 전원회의 5일째 회의를 진행했다. 회의는 31일에도 이어지고 있다.
미국은 북한이 이날 동해상으로 단거리탄도미사일 3발을 발사한 것은 미국과 동맹들에 즉각적인 위협이 되지 않는다고 밝혔다.
주한미군을 관장하는 미국 인도태평양사령부는 북한의 미사일 발사 직후 낸 성명에서 “한국과 일본 방어에 대한 미국의 약속은 굳건하다”며 이같이 밝혔다.
북한은 올해 들어 지난 23일까지 탄도미사일을 37차례, 약 70발 쐈고 순항미사일을 3차례 발사한 것으로 언론을 통해 공개됐다.
지난 26일에는 북한의 소형무인기 5대가 우리 영공을 침범했으며 그 가운데 1대는 서울 북부까지 진입했다가 돌아가는 등 연말에도 다양한 방식으로 대남 도발이 이어지고 있다.",경향
