,title,article,news
0,윤 대통령 “북 무인기 한 대 왔으면 우린 2~3대 보내라”,"윤석열 대통령이 28일 “북한의 어떤 도발에도 확실하게 응징, 보복하라. 그것이 가장 강력한 수단”이라고 말했다. 윤 대통령은 이날 예정된 오찬 일정을 취소하고 진행한 참모진과의 회의에서 이렇게 말했다고 김은혜 홍보수석이 전했다. 윤 대통령은 “북한에 핵이 있다고 주저하지 말라”고도 강조했다. 29일에는 국방과학연구소를 방문한다.      이는 국군 통수권자로서 북한 무인기 침범으로 인한 안보 불안감을 차단함과 동시에 북한에 강력한 경고의 메시지를 보내는 차원으로 풀이된다. 윤 대통령이 군의 감시·요격 시스템을 점검하고 보고받기 위해 국방과학연구소를 찾는다는 일정을 대통령실이 이례적으로 사전 공개한 것도 같은 맥락이다.      대통령실 고위 관계자는 “(이날 발언을) 한마디로 정리하면, ‘국민의 생명과 안전을 지키는 안보의 중요성은 여러 번 반복해도 부족함이 없다’는 것”이라며 “국민의 안전과 생명을 지키기 위해 대통령으로서 할 수 있는 모든 조치를 할 것이라는 의미”라고 전했다. 이 관계자는 또 “(대응 차원에서) 무인기를 북한으로 보낸 건 적을 굴복시키기 위한 창(槍)”이라며 “원점 타격과 확전 위험도 각오해가며 국민을 지키겠다는 통치 수반으로서의 윤 대통령의 의지가 반영된 것”이라고 했다. 군의 무능력한 대응이 이종섭 국방부 장관을 비롯한 군 내부 문책론으로 번질 가능성에 대한 질문에 이 관계자는 “군이 보다 확고한 대비 태세를 갖추고, 국민을 위해 군이 보여줄 수 있는 기강 확립에 대한 윤 대통령의 강조가 있었는데, 더 구체적으로는 말씀드리지 않겠다”고만 했다.      대통령실 안팎에선 잇따른 북한의 도발로 9·19 군사합의 무용론이 팽배한 상황이다. 대통령실 관계자는 “9·19 군사합의로 공군 정찰을 못 하게 돼 있는데, 위반이 일상화된 건 정상적인 상황이 아니다”며 “이날 회의에선 9·19 군사합의 위반에 대한 얘기가 주로 오갔다”고 말했다. 다만 일련의 도발로 윤 대통령이 내세운 대북 기조인 ‘담대한 구상’을 폐기하는 것은 아니라고 선을 그었다. 대통령실 고위 관계자는 “북한이 상징적 조치를 취할 경우 필요한 지원은 할 것”이라면서도 “9·19 합의 정신을 위배하면서 우리 국민을 위협하는 도발을 참으라는 건 굴종”이라고 말했다. 담대한 구상과 무력 도발에 대한 응징은 별개라는 뜻이다.      



이종섭 국방부 장관(오른쪽)이 28일 국회 국방위 긴급 현안질의에 출석해 북한 무인기 관련 의원들의 질의에 답변하고 있다. 장진영 기자           북한 무인기가 침범한 26일 윤 대통령이 “두 대, 세 대 올려보내라”고 지시하는 등 철저한 대응을 당부했지만, 군의 준비태세가 미흡해 격노했다는 내용도 공개됐다. 28일 기자들과 만난 대통령실 고위 관계자는 “처음 북한 무인기 한 대가 영공을 침범했을 때 윤 대통령은 ‘우리도 무인기를 갖고 있지 않나. 북한에 사후 조치를 즉각 시행하라. 한 대가 왔으면 우리는 두 대 혹은 세 대를 올려 보내도록 조치하라’고 지시했다”고 전했다. 윤 대통령은 “필요하다면 격추하고, 관련 조치들을 최대한 강구하라”는 지시도 내렸다.      컨트롤 주체는 합동참모본부였다. 당시 상황을 지켜본 대통령실 관계자는 “처음에는 ‘왜 빨리 격추를 못 하느냐’는 생각에 답답하다가, 나중에는 조금 이해하게 됐다”고 전했다. 실제 군은 “파리를 대포로 잡는다”는 비유대로, 1.8m에 불과한 무인기를 추적·격추하는 데 어려움을 겪었다. 복합 대공 레이더 등에 잡히질 않았고, 육안으로 식별했을 때는 무인기가 날아다니는 곳에 아파트 단지가 있어 대민 피해가 우려돼 사격할 수 없었다고 한다. 대통령실 고위 관계자는 “무인기가 이런 측면에서 비대칭 전략이라는 생각을 하게 됐다”고 말했다.      무인기 침범 다음 날인 27일 오전에는 김성한 국가안보실장 주재로 긴급 안보상황점검회의가 열렸다. 이종섭 국방부 장관과 김승겸 합참의장, 강신철 합참 작전본부장 등이 영공 침범 관련 사항을 점검했다. 당시 군은 공군 전력을 가동했지만, KA-1 경공격기가 추락하는 등 속수무책이었다.       국무회의 개의 시간인 10시30분이 가까워지자 김성한 실장과 이종섭 장관이 별도로 윤 대통령에게 대면 보고를 했다. 이때 윤 대통령은 “국방부와 군은 도대체 무얼 한 거냐”고 강하게 질책했다. 대통령실 고위 관계자는 “격노”라는 표현을 썼다. 이 관계자는 “윤 대통령이 군에 무한 신뢰를 보내고 있는데 그 신뢰를 충족하지 못했다. 훈련이 부족하고, 기강이 해이한 부분에 대해 강하게 질책하고 보완을 주문한 것”이라고 전했다.    ◆국방위, 장관 불러 현안 질의=이종섭 국방부 장관은 28일 국회 국방위원회 긴급 현안질의에 출석해 “어제 (합참) 작전본부에서 두 차례에 걸쳐 국민께 송구한 말씀을 올렸고 오늘도 마찬가지”라며 “국방부 장관으로서 북한 무인기 도발 상황에 대응하는 작전의 결과에 대해 국민께 송구하다는 말씀을 드린다”고 고개를 숙였다. 무인기가 용산 상공까지 비행한 것 아니냐는 질문에 이 장관은 “단계별 감시자산으로 확인되는데 용산에는 안 온 게 확실하다”고 답했다. 합참에 따르면 지난 26일 북한 무인기는 은평구부터 강북구까지 서울 북부 일대를 약 1시간에 걸쳐 좌우로 비행한 뒤 북측으로 돌아갔다.       국가안전보장회의(NSC)가 열리지 않았다는 지적에는 “NSC는 부처 간 협업이 필요하거나 중대 결정사항이 있을 때 여는데, 이번 사건은 작전이 우선이었다. 김성한 국가안보실장과 수도 없이 통화했고 김 실장은 대통령에게 보고했다”고 답했다.",중앙일보
1,"노웅래 체포안 부결...與 ""이재명 방탄 예고편""","“‘저번에 주셨는데 뭘 또 주냐’ ‘저번에 그거 제가 잘 쓰고 있는데’라고 말하는 노웅래(더불어민주당) 의원의 목소리, 돈봉투가 (오가며) 부스럭거리는 소리까지도 그대로 녹음돼 있다.”      한동훈 법무부 장관이 28일 오후 국회 본회의장에서 “노 의원이 청탁을 받고 돈을 받는 현장이 고스란히 녹음된 녹음파일이 있다”며 노웅래 의원에 대한 체포 동의 요청 이유를 설명했다. “지난 20여 년간 중요한 부정부패 수사 다수를 직접 담당해 왔지만, 부정한 돈을 주고받는 현장이 이렇게 생생하게 녹음돼 있는 사건은 본 적이 없다”고도 했다.      169석의 거야(巨野) 더불어민주당은 하지만 몰표로 동료 의원에 대한 ‘방탄’을 선택했다. 이에 한 장관은 “국민이 오늘 결정을 오래도록 기억하실 것”이라고 했다. 안호영 민주당 수석대변인은 “한 장관의 본분을 저버린 피의사실 공표와 자기정치는 오늘 노웅래 의원 체포동의안의 부결을 불러왔음을 똑똑히 알아야 할 것”이라고 책임을 돌렸다.      뇌물 및 불법 정치자금 수수 의혹을 받는 노 의원의 체포동의안은 이날 재적 299인 가운데 총투표수 271표, 찬성 101표, 반대 161표, 기권 9표로 부결됐다. 21대 국회에서 체포동의안이 부결된 건 처음이다. 앞서 정정순·이상직·정찬민 의원 체포안은 모두 가결됐다. 본회의에 앞서 야당인 정의당(6석)은 찬성 입장을 밝힌 만큼 “출석한 민주당 의원은 이탈 없이 반대표를 던졌을 것”이란 분석이 나온다.      노 의원은 한 장관의 이유 설명에 이어 발언권을 얻어 “방어권을 완전히 무시한 것이다. 사람 죽이는 수사”라고 했다. 그러면서 “한마디로 검찰이 만든 작품”이라며 “뇌물을 받은 것처럼 언론플레이해 재판도 받기 전에 저를 범법자로 만들었고, 저는 만신창이가 됐다”고 동정론을 호소했고, 결국 먹혔다.      민주당은 공식적으론 반대 당론을 정하진 않았다고 했지만, 본회의 직전 의원총회에선 박홍근 원내대표가 두둔 발언을 하고 “검찰 독재 저지하자”를 외치며 피케팅을 진행했다. 최근 민주당 의원 텔레그램방에는 노 의원의 호소 글에 응원 답글이 달렸고, 절대 체포안에 동의해서는 안 된다는 취지의 메시지가 많이 올라왔다고 한다. 한 민주당 의원은 “우리도 검찰에 당할 수 있다는 생각에 반대표를 던져야 한다는 공감대가 형성됐다”고 전했다.     ━   정의당 “가재는 게편, 민주당 방탄정당 오명”        한동훈 장관은 표결에 앞서 5분가량 ▶뇌물수수 현장 녹음파일 ▶“또 도와주느냐”는 노 의원 목소리가 담긴 전화통화 녹음파일 ▶청탁받은 내용을 더 구체적으로 알려달라는 노 의원 문자메시지 ▶공공기관에 국회 의정 시스템을 이용해 청탁 내용을 질의하고 회신하는 내역 등 구체적 증거도 나열했다. 통상 법무부 장관이 체포동의안에 대해 이유를 설명하기는 하지만, 한 장관처럼 구체적인 증거 내용을 공개하는 경우는 드물다. 그러면서 “(노 의원은) 자기 목소리가 나오는 현장 녹음까지 있는데도 수사기관의 조작이라고 거짓 여론전을 펼치고 있다”며 “2022년 대한민국에서는 어떤 공직자라도 명확한 증거들이 있음에도 수사기관의 조작이라고 거짓 음모론을 펴면서 부인하는 경우 예외 없이 구속 수사를 받게 된다”고 지적하기도 했다.  일각에선 한 장관의 설명이 오히려 민주당 의원들에게 위기감을 불러 방탄으로 똘똘 뭉친 계기를 제공했다는 해석도 나온다.      노 의원 체포안 부결엔 여당인 국민의힘뿐 아니라 정의당도 비판했다. 주호영 국민의힘 원내대표는 기자들에게 “이재명 대표에 대해서도 있을지 모르는 체포안에 대해 미리 예행연습한 것이라는 평가가 많다”며 “민주당은 불체포 특권을 없애자고 하면서도 자당 의원의 이익과 관계될 때는 철저히 방탄국회하는 모습을 보여줬다”고 꼬집었다. 또 “(임시국회 회기 마지막 날인) 1월 9일이 지나면 국회의 승인 없이도 체포가 가능한데, 그때 민주당이 어떻게 하는지 보면 방탄국회인지 알 수 있을 것”이라고 말했다. 김희서 정의당 수석대변인도 “가재는 게 편이라는 옛말이 틀리지 않는다. 민주당은 방탄 정당의 오명을 피할 수 없다”고 지적했다.      당초 4선의 노 의원이 뇌물 혐의를 부인하며 기자회견을 처음 가졌을 때만 해도 민주당 의원 중에 회견장에 동행한 이는 없었다. 수수방관하던 민주당이 노 의원 체포동의안 반대로 돌아선 데엔 “이재명 대표를 지키겠다는 의도와 무관치 않을 것”이라는 지적도 나온다. 김형준 명지대 특임교수는 “민주당 스스로 자해정치를 하고 있다”고 전했다.      한편 국회는 이날 본회의에서 한전채 발행 한도를 2배에서 6배로 늘리는 내용의 한국전력공사법(한전법) 개정안을 의결했다.       다만 안전운임제, 근로시간 연장 등 일몰제 관련법은 여야 간 합의 불발로 이날 본회의에 상정되지 못했다.",중앙일보
2,이재명 때린 17년전 이재명? '지자체 부정부패' 논문 재조명,"이재명 더불어민주당 대표가 성남FC 후원금 의혹과 관련해 검찰 수사를 받는 가운데 그가 17년 전 쓴 논문이 재조명받고 있다.      이 대표는 2005년 12월 가천대 행정대학원 행정학 석사 논문으로 ‘지방정치 부정부패의 극복방안에 관한 연구’를 제출했다. 이 대표는 논문에서 “지자체의 부정부패는 이해관계인과 정치권력을 지닌 지자체장의 부적절한 거래행위에서 비롯된다. 주로 지자체장이 당선이나 재선을 목표로 선거자금을 조정하거나 지지세력을 확보하기 위해 누군가에게 정상적이지 않은 특별한 이익 혹은 혜택·편의를 제공하는 행위”라고 적었다.      



이재명 더불어민주당 대표 최측근으로 최근 구속기소된 김용 전 민주연구원 부원장(왼쪽)과 정진상 전 정무조정실장. 연합뉴스       그간 이 대표 측은 성남FC 후원금 의혹과 관련해 “이 대표가 직접 돈을 받지도 않았고, 성남FC의 발전을 위해서 후원금을 유치한 것이어서 부정부패가 아니다”고 해명해왔다.      성남FC 후원금 의혹은 이 대표가 성남시장 시절이던 2014~2018년 두산건설, 네이버, 차병원 등 6개 기업에 인허가 등 특혜를 제공하는 대신 성남시가 운영하는 프로축구단 성남FC에 후원금 170억여원을 받은 의혹이다. 이 사건을 수사해온 수원지검 성남지청 형사3부(부장검사 유민종)는 당초 이 대표에게 28일 피의자 신분으로 출석해 조사를 받으라고 통보했지만, 이 대표 측은 검찰 측과 조율을 통해 내년 1월 10~12일 출석할 예정이다.      



지난해 11월 김진태 국민의힘 국민검증특별위원장 등이 경기 성남 백현동의 이른바 '옹벽 아파트'를 찾아 현장을 둘려보고 있다. 국회사진기자단       여권에선 이 대표의 과거 논문을 고리로 비판하는 목소리가 커지고 있다. 국민의힘 당권 주자인 김기현 의원은 지난 23일 페이스북에 “논문대로 엄정한 형 선고를 받고 영구적으로 공직 취임을 포기하라”고 했다. 국민의힘 중진 의원은 “이 대표가 스스로 ‘지자체장이 이권을 주고 반대급부로 정치적 이익을 얻었다면 부정부패’라고 규정했다”며 “그 논리라면 이 대표가 제3자 뇌물 혐의를 인정해야 한다”고 주장했다.      범죄 여부뿐 아니라 처벌에 관한 주장도 17년 전 논문에 등장한다. 이 대표는 최근 검찰이 수사망을 좁혀오자 “이재명 죽이기에 정권이 나섰다”며 자신이 정치탄압의 희생양이라고 주장하고 있지만 논문에선 오히려 “부패행위를 저지른 지자체장은 엄벌에 처해야 한다”고 적었다.      



2016년 당시 이재명 성남시장(가운데)가 광화문에서 기자회견을 하고 있다. 왼쪽에는 염태영 당시 수원시장, 오른쪽은 채인석 당시 화성시장. 연합뉴스       그는 논문에서 “지방정치인의 부패행위에 대한 관대한 처벌은 부패행위의 유인이 되기 때문에 예방을 위해서라도 엄정하게 처벌하는 것이 타당하다”며 “징역 이상의 형을 선고받아 피선거권을 박탈당하는 정치적 제재 이외에는 제재방법이 없다”고 주장했다. 중앙정부와 달리 지자체장의 부정부패는 감시하기 어렵기 때문에 일벌백계해야 한다는 취지다.      이 대표 부인 김혜경 씨 법인카드 유용 의혹 당시 제기된 ‘내부고발자’ 논란과 연결되는 내용도 있었다. 당시 민주당은 의혹을 제기한 경기도청 7급 공무원을 “정치적 이유로 폭로했다”며 강하게 비판했다. 하지만 이 대표는 논문에서 “지자체의 부패행위는 곧바로 적발이 어렵기 때문에 내부고발자에 대한 보호가 필요하다”고 적었다.       국민의힘 영남권 의원은 “이 대표의 17년 전 논문에 비춰 현재 이 대표 언행을 살펴보면 ‘누워서 침 뱉기’ ”라며 “‘야당 탄압’이라고 주장할 것이 아니라 성실하게 수사를 받는 것이 최선일 것”이라고 말했다.",중앙일보
3,"[단독] TBS 직원 10명중 6명 ""김어준 방송, 중립적이지 않다""","정치적 편향 논란이 끊이지 않던 TBS(교통방송) 라디오 프로그램 ‘김어준의 뉴스공장’(이하 뉴스공장)에 대해 TBS 직원 60% 이상이 “공정성에 문제가 있다”고 보는 것으로 드러났다.      중앙일보가 28일 입수한 TBS의 ‘공정성 평가를 위한 내부 조사’ 자료에 따르면 ‘TBS에서 제공하는 방송 콘텐트가 어느 정도 공정하느냐’는 질문에 응답한 직원 53.1%가 ‘공정하지 않다’고 답했다. 반면 ‘공정하다’는 의견은 27%에 그쳤다. 또 ‘TBS가 공정성 확보를 위한 내부 시스템을 보유하고 있느냐’는 질문엔 60%가 ‘보유하고 있지 않다’고 답해 ‘보유하고 있다’(21.9%)는 응답의 두 배를 훌쩍 넘었다.      이번 설문조사는 TBS가 여론조사업체 마크로밀엠브레인에 의뢰해 지난 12~16일 라디오 제작본부와 보도본부 등 TBS 직원 215명을 대상으로 진행됐다. 조사에 응답한 TBS 직원 상당수는 언론으로서 TBS의 공적 기능과 관련한 질문에 부정적 응답을 내놨다.      특히, 그동안 TBS를 둘러싼 논란의 중심에 섰던 뉴스공장에 관한 질문에 대한 답변이 그랬다. 불편부당한 입장에서 내용을 전달하는지 묻는 ‘중립성’ 문항에 ‘전혀 그렇지 않다’(40.5%)와 ‘그렇지 않다’(22.3%)는 응답이 전체의 62.8%를 차지했다. ‘매우 그렇다’(7%)와 ‘그렇다’(13%)는 응답은 20%뿐이었다. 각 입장을 균형있게 전달하는지를 묻는 ‘균형성’ 문항에서도 ‘전혀 그렇지 않다’(38.1%)와 ‘그렇지 않다’(22.3%)는 응답이 전체의 60%를 차지해 ‘매우 그렇다’(7.9%)와 ‘그렇다’(14.9%)는 답변을 압도했다. 드러난 사실을 정확하게 확인한 뒤 방송하는지를 묻는 ‘사실성’ 문항에서도 부정적으로 답한 응답자가 43.3%로 긍적적으로 답한 응답자 34.5%보다 많았다.      



김어준의 뉴스공장 유튜브 캡처       뉴스공장의 편향성 문제가 끊임없이 제기됐던 만큼 TBS 직원들은 ‘뉴스공장의 가장 대표적인 이미지’를 묻는 질문에 ‘편향성 시비 등의 논란’을 꼽는 비율이 59.9%로 압도적이었다. 다음으로는 ‘진행자의 독단’(21.9%), ‘출연자의 편향성’(10.2%), ‘방송 심의 관련 제제 등 규칙 위반’(4.4%), ‘언론탄압 등의 이슈’(3.6%)의 순서였다.      TBS 노사 동수가 참여한 ‘공정방송위원회’를 통해 진행된 이번 조사는 당초 공개를 전제로 진행됐다. 그러나 지난 16일 결과 집계 뒤 라디오제작본부 등 일부 조직에서 결과 공개를 막아서면서 지금까지 비공개됐었다. TBS 관계자는 “소수지만 기득권을 가진 자들이 (TBS) 대표 공석이라는 틈을 이용해 다수 직원들의 입장에 반하는 비민주적인 행위를 하고 있다”며 “소수의 기득권을 계속 유지시키고 새 대표가 할 수 있는 권한을 대폭 축소시키려는 것”이라고 주장했다.      방송인 김어준씨가 2016년 9월부터 진행한 뉴스공장은 20분기 연속 서울·수도권 라디오 청취율 1위를 기록하는 등 정량적 성적표로만 보면 상당한 성과를 거뒀다. 하지만 동시에 “야권 진영과 지나치게 밀착됐다”는 불명예도 함께 얻었다. 지난 3·9 대선 때 김씨는 자신이 운영하는 유튜브 채널 ‘다스뵈이다’에서 이재명 당시 더불어민주당 대선 후보를 공개 지지해 논란을 빚었고, 그 여파로 뉴스공장이 방송통신심의위원회 선거방송심의위원회로부터 법정제재를 받기도 했다.      지난달 서울시의회는 TBS에 대한 서울시 예산 지원을 중단하는 조례안을 통과시켰고, 공정성 논란으로 노조에서 사퇴 요구를 받아 온 이강택 전 대표는 임기 만료(2023년 2월)를 석 달 앞둔 지난달 15일 건강상 이유로 사표를 냈다. 김씨 또한 올 연말 뉴스공장에서 하차한다.",중앙일보
