,title,article,news
90, 시민단체 국고보조금 전면 감사 착수…노조 이어 시민단체 압박 본격화,"
윤석열 정부가 시민단체에 지급된 국고보조금을 두고 전면 감사에 착수한다고 28일 밝혔다. 보조금 지원단체 선정 과정과 회계처리 등 전반이 정부 심판대에 오른다. 노동조합 회계 손보기에 이어 시민단체에 대한 압박을 본격화한 것으로 풀이된다. 윤 대통령은 대선 과정에서 일부 노동조합과 시민단체들을 현 야권과 묶인 ‘이권 카르텔’로 보고 비판해 왔다.
이관섭 대통령실 국정기획수석은 이날 용산 대통령실 청사에서 브리핑을 열고 이 같은 내용의 ‘비영리민간단체 보조금 투명성 제고 추진’ 방안을 발표했다.
이 수석은 “윤석열 정부는 비영리 민간단체보조금의 투명성을 높이는 것을 국정과제로 선정한 바 있다”며 “우선 정부 전체 민간단체 보조금 지원 현황을 전수조사해서 파악하고 그 토대 위에서 향후 개선방안을 마련하기로 했다”고 말했다.
대통령실은 막대한 정부 보조금 규모, 불투명한 보조금 사업 관리 등을 감사 추진 근거로 들었다. 이날 대통령실은 2016~2022년까지 지난 7년간 민간단체에 지급한 정부 보조금이 총 31조4000억원이라고 밝혔다. 2016년 3조5600억원 규모에서 2022년에는 5조4500억원 수준으로 2조원 가량이 늘었다고 했다. 특히 전임 문재인 정부에서 연평균 4000억원 정도가 증가했다고 짚었다. 반면 2016년 이후 전 부처에서 적발한 문제사업은 153건, 환수금액은 34억원으로 평균 2000만원 정도 환수에 그쳤다고 대통령실은 설명했다. 이 수석은 이 같은 수치를 밝히며 “보조금 사업이 전혀 관리가 되지 않았던 것이 아닌가 생각한다”고 말했다.
이에 따라 정부는 내년 상반기 안에 각 부처별로 민간단체 보조금에 대한 전면적 자체 감사를 실시한다고 밝혔다. 지원단체 선정의 적절성, 회계의 투명성, 목적에 맞는 집행 여부 등 전반이 집중 감사 대상이다. 부처별 감사가 적절하게 이뤄졌는지는 몇 개 부처를 ‘샘플링’하는 방식으로 다시 점검할 계획이다. 감사 결과에 따라 문제 사업은 ‘과감한 정비’, 보조금 관리는 ‘대폭 강화’한다고 대통령실은 밝혔다.
시민단체 회계에 ‘돋보기’를 들이대는 것은 윤석열 정부 출범 후 예견된 수순이다. 윤 대통령은 대선 과정에서 정의기억연대 사건 등을 거론하며 시민단체 공금 유용과 회계 부정 방지 공약을 내걸었다. 우선 정부가 나서 국고보조금을 들여다보는 것으로 시민단체 ‘정리’를 본격화한 것으로 풀이된다. 민간단체 보조금 감사 계획을 대통령실에서 발표한 것이 이례적이라는 시각도 있다.
이날 대통령실 발표에서도 전임 정부와 야권을 겨냥한 언급이 적지 않았다. 대통령실은 보조금 집행 문제 사례로 ‘세월호 피해자 지원을 위한 재단사업에서 총 10건의 문제있는 회계처리가 발견되어 회수한 사례’, ‘청소년 동아리 지원 사업비가 반정부 시위를 주도하는 정치단체로 지원된 사례’ 등을 적시했다. 대통령실 고위관계자는 기자들과 만나 “서울시 공동예산으로 학생 동아리 지원사업에 ‘촛불 중·고생’ 사례가 있는데 중·고생에 촛불을 들게 한 데 정부 지원금이 나간 것이 어떻게 됐나 하는 궁금증에서 (지원금 점검이) 시작됐고 아무도 관리하지 않는다는 걸 인지했다”며 “정부 지원금의 회계 투명성이 높아져야 (국민들이) 단체를 신뢰할 수 있다는 생각에 시작하게 됐다”고 말했다.
감사 추진 이면에는 노동조합과 시민단체가 야권과의 ‘이권 카르텔’로 묶여있다는 윤 대통령의 인식이 깔려있는 것으로 보인다. 윤 대통령은 정치참여 선언 당시 전임 정부를 ‘이권 카르텔 약탈 정부’로 규정했다. 이후 대선 과정에서 전국민주노동조합총연맹(민주노총), 전국교직원노동조합(전교조)과 함께 일부 시민단체를 야당과 이권을 나누는 집단으로 묶어 비판해왔다. 윤 대통령은 대선을 앞둔 지난 3월1일 시민단체 불법이익 환수 공약을 밝히며 “정치권력은 시민단체를 세금으로 지원하고 시민단체는 권력을 지지하는 부패 카르텔이 만들어졌다”고 했다. 지난 2월 유세에선 “(전 정부는) 오로지 민노총, 전교조와 몇 개 시민단체를 끼고 자기들끼리 나눠 먹었다”고 했다. 윤 대통령은 전날 국무회의에서도 “국민의 혈세가 그들만의 이권 카르텔에 쓰여진다면 국민 여러분께서 용납하지 않을 것”이라고 이권 카르텔을 언급했다.
이 때문에 향후 감사 과정에서 이념 지형에서 전임 정부와 가까운 시민단체들이 집중 감사 대상에 오를 거란 전망이 나온다. 내년 상반기 감사가 마무리된 후에는 유용 실태에 따른 수사기관에 대한 수사 의뢰 등 후속조치가 따를 것으로 보인다. 이 고위 관계자는 “꼭 문재인 정부만의 문제가 아니고 여러 정부를 거치는 동안 비영리민간단체에 대한 보조금이 꾸준히 늘어왔고 특히 문재인 정부 들어서 그 증가 속도가 굉장히 빨랐다”면서 “민간단체 보조금의 증가 속도에 비해서 관리시스템은 적절히 마련되지 못한 것”이라고 정치적 해석에 선을 그었다.",경향
91," 전현희, 윤사모 퇴진 요구에 “임기는 국민과 약속” 尹 발언으로 응수","
전현희 국민권익위원장이 윤석열 대통령 지지자들의 퇴진 요구에 대해 윤 대통령이 검찰총장 당시했던 “임기는 국민과의 약속”이라는 말로 응수했다
전 위원장은 28일 자신의 사회관계망서비스(SNS)에 2020년 10월 당시 검찰총장이었던 윤 대통령의 기사를 올렸다. 당시 검찰총장 사퇴 압박을 받고 있던 윤 대통령은 국회에서 ‘식물총장이라는 이야기까지 나오는데 사퇴하라는 압박이 아니냐’는 질문을 받고 “임기는 국민과의 약속, 어떤 압력이 있더라도 소임을 다할 생각”이라고 답했다.
이날 ‘윤사모’(윤석열을 사랑하는 모임) 중앙회 회원들이 세종시 정부세종청사 국민권익위원회 앞에서 전현희 국민권익위원장의 사퇴를 요구하는 집회를 열었다. 윤 대통령의 발언으로 자신도 정해진 임기를 지키겠다는 입장을 재차 밝힌 것으로 보인다.
문재인 정부에서 임명된 전 위원장은 여권 등으로부터 사퇴 압박을 지속적으로 받고 있다.
앞서 감사원은 지난 8월1일부터 9월29일까지 두 달간 권익위를 상대로 특별 감사를 진행했다. 감사원은 감사를 마친 뒤 전 위원장이 추미애 전 법무부 장관 아들의 군 특혜 의혹, 서해 공무원 피격 사건 관련 유권해석을 내놓는 과정에서 부당한 영향력을 행사했다며 직권남용 혐의로 검찰에 수사를 의뢰했다. 현재 경찰이 이 사건을 수사 중이다.
전 위원장은 최재해 감사원장과 내부 제보자 의혹을 받는 권익위 관계자 등을 고위공직자범죄수사처에 고발한 상태다.",경향
92," 김정은, 무인기 도발 뒤 “국방력 새 핵심목표”···내년도 “대적투쟁”에 ‘강 대 강’","
김정은 북한 국무위원장이 “2023년도에 강력히 추진해야 할 자위적 국방력 강화의 새로운 핵심 목표들”을 제시했다. 고체연료 대륙간탄도미사일(ICBM) 등 계획된 전략무기 개발뿐 아니라 무인기 등 남측의 취약점을 공략하는 무기체계 고도화에 나설 수 있다는 분석이 나온다. 김 위원장은 “대적투쟁 방향”을 명시하며 내년에는 더 강력한 대남 ‘강 대 강’ 기조를 시사했다.
김 위원장이 27일 평양 노동당 중앙위원회 본부청사에서 이틀째 주재한 당 중앙위 제8기 제6차 전원회의 보고에서 “다변적인 정세파동에 대비하여 2023년도에 강력히 추진해야 할 자위적 국방력 강화의 새로운 핵심 목표들이 제시되였다”고 조선중앙통신이 28일 보도했다. 당 전원회의에선 올해 사업 결산과 내년 주요 정책방향에 대한 논의가 진행되고 있다.
김 위원장이 보고한 “새로운 핵심 목표들”의 구체적 내용은 공개되지 않았다. 전문가들은 “새로운”이라는 표현에 주목하고 있다. 지난 26일 남측 영공을 침범한 무인기 도발과 같이 남측의 군사적 허점을 파고드는 비대칭 전력 등 무기체계 개발을 시사한 것이라는 추정이 나온다.
홍민 통일연구원 북한연구실장은 기자와 통화에서 “무인기와 같이 가성비 높고 한국의 취약점을 극대화하는 무기체계를 별도로 제작하는 것이 내년의 기본사업이 될 가능성이 높다”고 말했다. 임을출 경남대 극동문제연구소 교수는 통화에서 “이번 무인기 사태와 같이 허를 찌르며 한·미의 다양한 대응태세를 무력화시킬 수 있는 새로운 무기들을 제시했을 가능성이 높다”고 분석했다.
지난해 8차 당대회에서 제시된 ‘국방과학 발전 및 무기체계 개발 5개년 계획’의 큰 틀 안에서 전략무기 개발 우선순위 등을 조정할 수 있다는 평가도 제기된다. 올해 일정 성과를 낸 고체연료 엔진 ICBM 개발, 내년 4월로 예고한 군사정찰위성 발사, 다종의 전술핵 투발수단 개발 등에 주력할 가능성이 있다. 전략무기 개발 핵심과제 가운데 아직 선보이지 못한 초대형 핵탄두와 핵잠수함 개발 등에 적극 나설 수도 있다.
김 위원장은 올해의 ‘강 대 강’ 기조를 이어가며 대화·협상 국면으로의 전환을 시도하지 않겠다는 뜻을 내비쳤다. 김 위원장의 보고에서 “현 상황에서 우리 당과 공화국 정부가 국권수호, 국익사수를 위하여 철저히 견지해야 할 대외사업 원칙과 대적투쟁 방향이 명시됐다”고 통신은 전했다.
박원곤 이화여대 북한학과 교수는 통화에서 “대남·대미 강경정책을 기본으로 하고 (미국의) 대북 적대시정책 우선 철회 없이 대화는 없다는 입장을 바꾸지 않은 것으로 보인다”고 말했다. 홍민 실장은 “‘대적’이라는 표현은 한국에 불만을 표시하고 응징성 행동을 하겠다는 데에 특화된 용어”라며 “내년 한·미 훈련이 본격화돼 연중 확장억제가 작용할 소지가 높은 상황에서 북한이 계획을 갖고 올해보다 더 공세적 행동에 나서겠다는 의도”라고 분석했다.
통신에 따르면 김 위원장의 보고에서 “조선반도(한반도)에 조성된 새로운 도전적 형세와 국제정치정세가 심오하게 분석 평가”됐다. 올해 한·미·일이 동맹에 버금갈 정도로 대북·대중 군사협력을 강화하고, 전세계적으로 미·중 전략경쟁과 우크라이나 전쟁을 통한 미·러 대립이 격화된 정세를 거론했을 것으로 추정된다.
김 위원장은 국제 정세가 “다극화” “신냉전” 체제로 접어들었다는 인식을 여러 차례 드러내왔다. 전세계적인 미·중, 미·러 갈등 틈에서 한·미·일 군사협력 강화를 빌미삼아 핵무력을 급속도로 고도화한다는 방침을 이어갈 것으로 예상된다.",경향
93, 윤 대통령 “북한 도발 확실하게 응징·보복해야···핵 있다고 두려워하면 안 돼”,"
윤석열 대통령이 북한 무인기 영공 침범과 관련해 “북한의 어떤 도발에도 확실하게 응징, 보복하라”면서 “북한에 핵이 있다고 해서 두려워하거나 주저해선 안된다”고 28일 말했다.
윤 대통령은 이날 낮 대통령비서실·안보실 참모들과 함께 한 회의에서 지난 26일 북한의 무인기 도발과 관련해 이같이 말했다고 김은혜 홍보수석비서관이 오후 브리핑에서 전했다. 윤 대통령은 이 자리에서 북한 도발에 대한 확실한 응징과 보복을 강조하며 “그것이 도발을 억제할 수 있는 가장 강력한 수단”이라고 강조했다.
북한 무인기 대응을 두고 윤 대통령과 군에 대한 비판이 제기되는 가운데 군사적 강경 대응 기조를 강조한 것이다. 비판 여론 무마용 발언이라는 지적와 함께 한반도 군사적 긴장도를 높일 것이란 우려도 나온다.
윤 대통령은 이날 회의를 위해 당초 예정돼 있던 국가균형발전위원장 등 위촉장 수여식 겸 오찬 일정을 취소했다.
윤 대통령은 오는 29일 대전 국방과학연구소(ADD)를 방문하기로 했다고 김 수석은 전했다. 드론·미사일 등 비행물체에 대한 감시·정찰·요격시스템과 공격용 미사일 개발 상황을 종합점검하고 보고받기 위해서다.
윤 대통령은 전날에는 군의 무인기 대응에 격노하고, 이종섭 국방부 장관 등을 강하게 질책한 것으로 전해졌다. 국무회의 직전 이 장관과 김성한 국가안보실장으로부터 무인기 대응 관련 보고를 받고 “그동안 도대체 뭐한 것이냐. 훈련도 제대로 안한 것이냐”며 언성을 높였다는 것이다. 대통령실 고위관계자는 이날 기자들과 만난 자리에서 “대통령은 우리 군에 무한 신뢰를 보내고 있지만, 그 신뢰에 바탕을 둔 기대수준을 충족시키지 못한 것에 대해 기강이 해이하고 훈련이 대단히 부족한 것이 아닌지 강하게 질책하고 주문한 것으로 이해하면 된다”고 설명했다.
윤 대통령은 전날 국무회의에서 “2017년부터 드론에 대한 대응 노력과 전력 구축이 제대로 되지 않고, 훈련은 아주 전무했다”면서 전임 정부를 강하게 비판했다. 그는 “(무인기 영공 침범) 사건을 게기로 해서 드론부대 설치를 최대한 앞당기겠다”며 북한 도발에 맞선 주요 군사시설 감시·정찰 드론부대를 조기 창설하겠다고 밝혔다.",경향
94," [속보]국회, 노웅래 민주당 의원 체포동의안 부결","
노웅래 더불어민주당 의원에 대한 체포동의안이 28일 국회에서 부결됐다.
국회는 이날 본회의에서 노 의원에 대한 체포동의안을 재석 의원 271명 중 찬성 101표, 반대 161표, 기권 9표로 부결했다. 체포동의안은 재적 의원 과반 출석, 출석 의원 과반 찬성으로 가결된다.
검찰은 2020년 2월부터 12월까지 5차례에 걸쳐 뇌물 및 불법정치자금 6000만원을 받은 혐의 등을 적용해 노 의원에 대한 구속영장을 청구했다.
앞서 21대 국회에서는 정정순 전 민주당 의원, 이상직 전 무소속 의원, 정찬민 국민의힘 의원에 대한 체포동의안 표결이 진행됐고 모두 가결됐다.",경향
95," 김경수, 노무현 묘역 참배로 첫 출소 일정···“국민통합 최선 다하겠다”","
김경수 전 경남지사는 28일 경남 김해시 진영읍 봉하마을 내 노무현 전 대통령 묘역을 참배하며 출소 후 첫 공식 일정을 시작했다. 더불어민주당 내에서는 ‘원조 친문재인계’ 정치인 김 전 지사의 역할론을 기대하는 목소리가 나오고 있다.
김 전 지사는 이날 배우자 김정순씨와 함께 봉하마을에서 권양숙 여사를 예방한 뒤 고 노 전 대통령 묘역을 참배했다. 방명록에는 ‘대통령님께서 왜 그렇게 시민민주주의와 국민통합을 강조하셨는지 이제야 조금 알 것 같습니다. 남아있는 저희들이 끝까지 최선을 다하겠습니다. 보고 싶습니다. 사랑합니다, 대통령님’이라고 적었다.
김 전 지사는 참배 후 기자들과 만나 “왜 노무현 (전) 대통령께서 대연정 제안까지 하면서 지지자들에게 비난을 받고 등 돌림을 당하면서까지 국민통합에 신경을 썼는지 우리가 다시 되돌아봐야 한다”며 “어느 정부가 개혁하더라도 정권이 바뀌면 사상누각이 되는 일들이 반복되는 것이 국가적으로 불행한 일”이라고 말했다.
김 전 지사는 앞으로 계획을 묻자 “가족들과 시간을 보내고 마지막에 저도 생각을 정리해서 기회가 되면 말씀드리겠다”고 말을 아꼈다. 문재인 전 대통령의 양산 사저 방문 계획을 묻자 “조만간 인사드리러 한번 가야 하지 않겠나”라고 말했다. 앞서 김 전 지사는 전날 출소 후 약식 기자회견에서 “이번 사면은 저로서는 받고 싶지 않은 선물을 억지로 받게 된 셈”이라고 윤석열 정부에 쓴소리했다.
민주당 내에서는 한때 대선 잠룡으로 꼽혔던 김 전 지사가 모종의 정치적인 역할을 맡을 수 있다는 관측이 나온다. 다만 김 전 지사가 이재명 대표의 대안이라는 확대 해석은 경계하는 분위기가 지배적이다. 전재수 의원은 이날 SBS 라디오 인터뷰에서 김 전 지사를 “노무현 가문의 정치인”으로 규정하면서도 이 대표의 사법 리스크와 김 전 지사의 행보를 연결하는 것은 “굉장히 정치공학적”이라고 선을 그었다. 박주민 의원은 이날 BBS 라디오 인터뷰에서 “포스트 이재명이라기보다는 당의 유용한 인재로 쓰일 수 있다”고 말했다.
박정하 국민의힘 수석대변인은 이날 논평에서 “신년 특별사면을 두고 받고 싶지 않은 선물 운운하는 김 전 지사의 모습은 우리 정치의 발전과 국민통합의 목적마저 퇴색시킨 채 실망마저 안겨줬다”며 “특별사면이 됐다고 해서 원죄가 사라진 것으로 단단히 착각이라도 하고 있는 것인가”라고 비판했다.",경향
96," 광주 찾은 이재명 “하나회 만든 검찰, 이재명 죽여서 무능 가려지나”","
이재명 더불어민주당 대표는 28일 광주에서 “검찰이 하나회를 만들어 사회 요직을 다 차지하고 있다”며 “이재명을 죽인다고 그들(윤석열 정부)의 무능과 무책임이 가려지겠나”라고 말했다. 민주당 핵심 지지 지역에서 자신에 대한 검찰 수사를 비판하며 지지 세력을 결집하기 목적으로 풀이된다. 이날 이 대표를 소환조사하려던 검찰은 다음달 10~12일 출석을 이 대표에게 제안했고, 이 대표는 일정 조율에 들어갔다.
이 대표는 이날 광주 광산구 송정매일시장에서 ‘검찰독재 야당탄압 규탄연설회’를 열고 윤석열 정부의 검찰 수사를 비판하며 이같이 말했다. 이날은 검찰이 성남FC 후원금 의혹과 관련해 이 대표에게 소환조사를 받으라고 요구한 날이다. 앞서 이 대표는 지난 26일 광주 일정 등을 이유로 이날 소환에는 응하지 않지만 향후 조사 방식 및 시기를 조율하겠다고 밝힌 바 있다.
이 대표는 이날 “숨쉬기 점점 어려워지는 퇴행의 시대”라며 “내 편은 있는 죄도 덮고, 미운 놈은 없는 죄도 만들어 탈탈 털어 먼지를 만들어서라도 반드시 제거하겠다는 것이 국민이 맡긴 권력을 행사하는 공직자의 합당한 태도냐”고 했다.
이 대표는 또 “이재명을 지키지 말고 나라를 지키고, 민주주의를 지키고 여러분 스스로를 지키고 우리의 이웃과 가족을 지키자. 함께 싸워야 한다”면서 “민주당은 하나다. 우리는 하나로 뭉쳐서 미래를 향해 나아갈 것”이라고 말했다.
이 대표는 윤석열 대통령을 겨냥해 “마치 고스톱을 쳐서 딴 돈처럼 ‘내 마음대로 하면 그만이다, 국민들이 죽어나가든 말든 나만 잘 먹고 잘 살면 된다’는 식으로 해서야 되겠느냐”고 말했다.
이 대표는 전날 전남 무안군에서 연 국민보고회에서 “나라가 나를 고발하지 않을까, 압수수색하지 않을까, 잡아가지 않을까 걱정하는 게 정상이냐”며 “검사 60~70명, 수사관까지 하면 200~300명이 저를 잡아보겠다고 다른 사건을 다 팽개치고 매달려있지 않느냐”고 말했다.
민주당은 이날 의원총회에서 “정치검찰의 유례없는 야당파괴, 정적제거 수사를 강력하게 규탄한다”는 내용의 결의문을 낭독했다. 이들은 “민주당 인사들에 대해서는 먼지털이식 수사로 겁박하고, 이명박 적폐세력, 박근혜 국정농단 세력들에게는 사면권을 남용해 모조리 면죄부를 부여했다”며 “이것이 대통령의 법치이며 공정과 상식인가”라고 밝혔다.
검찰은 이날 출석하지 않은 이 대표에게 다음달 10~12일을 새 출석일로 제안했다. 이 대표는 이날 국회 본회의에 참석한 뒤 기자들과 만나 이같이 전하며, 일정을 조율 중이냐는 질문에 “네. 출석하기로 했다. 그렇게 아시면 된다”고 답했다.
앞서 이 대표는 이날 오전 광주 서구에 있는 일제 강제동원(징용) 피해자 양금덕 할머니 자택을 찾았다. 이 대표는 양 할머니를 만나 일본의 강제동원 피해자 배상에 국내 기업이 참여하도록 하는 한국 정부 방침에 대해 “피해자를 모욕하는 것 같다”며 “누군가에게 피해를 입고 ‘사과하라, 책임져라’라고 하는데 (제3자가) ‘내가 돈 줄게’라는 것과 같아서 마음이 좋지 않다”고 말했다. 양 할머니는 “그 사람들에게 사죄받고 싶다. 잘못한 사람에게 사죄받아야 편하지 우리 같은 동지끼리 내가 받으면 마음이 안 좋다”고 말했다.
이 대표는 이어 민주당 광주시당에서 열린 현장 최고위원회의에서도 “양 할머니께서 (정부 방침에) 매우 분개를 하신다. 한국 기업들이 왜 배상 책임을 지겠다는 것인지 납득할 수 없다면서 험한 말씀까지 하셨다”며 “양 할머니에 대한 (정부의) 인권상 시상, 국가 훈장 수여가 미뤄진 것과도 관련 있어 보인다”고 말했다.
이 대표는 김광동 진실화해를위한과거사정리위원장에 대해 “광주 5·18 북한군 개입 가능성을 운운했던 사람이 진실화해위원장에 올라가 있는데 도저히 납득할 수 없다”며 “이것 역시 국민을 모욕하는, 광주를 모욕하는 행위다. 이 인사에 대한 해임을 촉구하는 바이다”라고 말했다.",경향
97, 이번엔 ‘풍선’ 항적에 전투기 출격시킨 군,"
군 당국이  28일 새벽 미상 항적을 포착하고 전투기를 출격시켰지만 북한 무인기가 아닌 ‘풍선’이었던 것으로 전해졌다.
군에 따르면 이날 새벽 레이더에 정체를 알 수 없는 항적이 일부 식별되어 비상대기 중이던 공군 전투기가 긴급 출격해 인천과 경기 북부 상공 등으로 전개했다.
레이더에 항적이 포착된 상공에서 공군 조종사가 눈으로 확인한 물체는 풍선의 모습이었으며 군은 항적이 북한 무인기의 흔적은 아니라고 판단한 것으로 알려졌다.
군은 당시 항적 등을 바탕으로 종합적으로 추가 분석할 방침이다.
공군 전투기가 출동하는 과정에서 인천과 경기 고양, 서울 일부 지역에서 새벽 0시40분쯤 갑작스러운 굉음에 놀랐다는 민원이 이어졌다.
군은 지난 26일 북한 무인기 5대가 서울을 포함한 남측 영공에 침범한 것을 포착하고 100여 발의 사격을 가했지만 격추에 실패했다. 지역 주민들에게도 관련 안내 공지를 하지 않아 비난이 쏟아졌다.
이후 군은 정체불명의 항적이 북한 무인기일 가능성을 염두해 두고 공세적으로 대응하고 있다. 전날에는 북한 무인기로 추정되는 미상 항적을 탐지하고 타격자산을 투입했지만 새 떼로 밝혀졌다.",경향
